,Package name,Reviewer name,Review,Rating
318,xyz.klinker.messenger,A Google user,pulse fantastic smsmms app design intuitive app featurerich user experience enjoyable overall fluidity cleanliness ui two point emphasis view application one surpass expectation fantastic responsive dev add experience complaint occasionally miss mms app otherwise receive native app android mesaage try mms apn setting carrier avail final point alone app lose star forty - five overall,4
319,xyz.klinker.messenger,Vincent N Erica Shaw,side message there s waste space surface duo small column fold mode book mode tablet still empty space look enough large canvas span across two screen also assign message folder doable main screen select multiple message take far many click bury menu many message,3
320,xyz.klinker.messenger,Alex Isabel,terrible bug use love app get lifetime subscription year ago cause issue whenever uninstall app go back default samsung message app automatically trigger text message get send everyone without permission terrible factory reset phone stop text go issue never happen start use pulse sm also seem like old lifetime subscription almost do not work properly,1
321,xyz.klinker.messenger,Tony Vangel,threewks well easy feature fill texteightng app eleven come could find send delay mark read together fortunately also feature place right place make smooth run glance tell easily have not read yet con u could create thick line send delay pretty thin miss one glare appearance fall tad behind textra do not care cuz good still,5
322,xyz.klinker.messenger,A Google user,need improvement contact sync two conversation scroll bar disappear windows application badly need template window app notification sound depend window contain app wish display set preview msg leave expand view right do not like go back forth inconvenient pain window app need medium file manager medium easily add local file great otherwise,4
323,xyz.klinker.messenger,Jon Doe,edit seem lot problem send receive photo reason I m guess setting type adjust be not necessary message app I ve use finally I ve find absolutely fantastic messaging app professional appearance excellent variety customization,4
324,xyz.klinker.messenger,Stacy Steinzeig Smith,hate four text never send switch different texting app send important get piss thought ignore useless p get back complete nightmare really want hang twenty want back couple email back forth go day,1
325,xyz.klinker.messenger,Mopar Man,problem develop texte photo take first photo subsequent attemp attach photo do not work photo checkmark do not anything blank screen I ve clear memory even uninstalle reinstalled app problem text multiple photo use full screen take first picture quick internet search show multiple people exact problem pulse sm app,1
326,xyz.klinker.messenger,A Google user,first let start positivie sm app go one good be not rate five star pulse sm desktop component use cross platform supposedly surface recent assign macbook air professor duty least per week seem I m refresh account password know set week ago correct one desktop app will not log use credential end end encryption developer say can not simply provide password reset use password encryption key acceptable simple way reset password decrypting message do not know other seem make work despite highlevel security figure ill give five star,3
327,xyz.klinker.messenger,Robin McClure,I ve use app year I ve mostly enjoy sometimes text would not would drop biggie get pay version trial change phone broke download pulse new phone send texts response do not think chew husband texting back send screenshot conversation end ton response download different app thirty text come bye pulse,1
328,xyz.klinker.messenger,A Google user,increasingly frustrate app fossil q smartwatch always need restart keep always dark theme window app sync either website version message watch come phone matter many time hit sync button message populate either window app web online sm fact extensive faq library explain straight forward app,3
329,xyz.klinker.messenger,Steve DeBow Jr,use love app try look back old message long able loaded month seem load sure due update main reason use app ability save message basically pay version kik message disappear reach certain unknown limit far tell app head downward spiral buyer beware issue still resolve numerous update reinstall,1
330,xyz.klinker.messenger,A Google user,app great try app add feature phone include membership let create account let view send message web browser find web browser slow send message downloadable program run computer do not seem send message,5
331,xyz.klinker.messenger,Sherrilee,simply good sm app multi device I ve use pulse several year without major issue complaint come text occasionally say send laptop already send phone watch imo good multi platform sm app I ve try other include verizon message habit send one message multiple timesvery annoying keep return pulsetrie true,5
332,xyz.klinker.messenger,Theresa Williams,pulse app great visual appeal love color create contact group chat do not care color create custom color combo another great feature ability sync website much easy type message online I m front computer vs type phone great job,5
333,xyz.klinker.messenger,W TF,good sm app I ve find originally think app choose strange proper noun instead common word nevis instead rast instead etc developer say that s cause keyboard app fortunately choose remove prediction word do not want pulse sm pretty intuitive far sentence structure prediction,4
334,xyz.klinker.messenger,A Google user,accidentally buy lifetime version instead free trial let slide able text computer seem worth mistake however recently web version sync phone render completely useless app phone resende old message people middle night I d love refund go back textra,2
335,xyz.klinker.messenger,A Google user,app pretty great box tweak well message app I ve ever use everything want even feature do not know want yet also reset phone pay ninety - nine cent back everything simple sign email boom everything back like,5
336,xyz.klinker.messenger,/mark (aleitt),great sms app replacement use year even native pc program surprisingly one linux much color customization other that s important like ability swipe delete message handy clean message inbox quickly want able send receive text message browser tablet windows app program excellent highly recommend,5
337,xyz.klinker.messenger,A Google user,pretty good schedule text feature use however android update start resende old message picture mms currently country android update instal fiance receive dozen photo year ago concern also international rate else receive old text message idea indication even send message even do two,4
338,xyz.klinker.messenger,A Google user,edit two mms function stop work recipient long receive image send edit great app browser support easily communicate via text without phone next customization simple work well thank dev get back promptly enjoy app much,3
339,xyz.klinker.messenger,Patrick Santy,"two hundred twelve thousand twenty - one ok finally work design I m satisfied support helpful thank guy awesome able sendreceive text phone desktop tablet great app disregard follow one million , two hundred fifty - two thousand twenty - one write year ago do not sync message delay msg send receive try resolve day disappoint much change message app goodbye pulse",5
340,xyz.klinker.messenger,Jon Kotowski,pretty darn good border great nothing lose star put phone work well galaxy watch thing wish would let adjust lead color notification per person say can not google issue text app wish notification icon different contact window type text small would like still good,5
341,xyz.klinker.messenger,Haikaz Dermenjian,overall great app definitely worth price tag several month use admit far one buggy app ever own web interface phone sm app go sync lot mean cat text web phone will not show sure go text text duplicate phone although one line send text nothing sit much headache sadly need uninstall think bad part reach dev get response get he s one guy major issue lot potentical many bug can not deal anymore fun last note eight user update previous issue note eight find issue main issue verizon send text android apple user b note eight slow buggy use app I m sure verizon ever fix issue open many ticket zero response long story short move tmobile upgrade note twenty issue resolve I m happy camper love app use daily thank dev sorry bad review early wish know write on one cheer,5
342,xyz.klinker.messenger,John Morris,I ve issue pulse app past two day I ve connectivity phone desktop apps period time I ve also issue browser app time confirm device currently significant issue send message receive message much consistent send currently mobile phone desktop app also browser app extension send message currently something go system account try perform account reset unsuccessful also,4
343,xyz.klinker.messenger,Darryl Franks,update upgrade two star five turn issue device sync never set account properly delete account create login info I m able sync datum phone tablet laptop fyi lose datum delete create new account I ve try several sm app year pulse good choice,5
344,xyz.klinker.messenger,danred99,good app I ve find text message discover look way backup message outside standard google backup system use phone across device design would nice could easily add additional people group text already start,5
345,xyz.klinker.messenger,Mike Roedema,I d happily use app year half certainly one well option desktop text message however I ve get annoyed message sync appear order though I d pay one thousand ninety - nine lifetime membership I m test free phone desktop app phone companion mobile app microsoft well web version verizon message message web google,3
346,xyz.klinker.messenger,Alvin Mast,mostly good app bug private conversation sometimes get get conversation list private conversation mix do not use function irrelevant otherwise android version good desktop version linux do not resizeable window downside,4
347,xyz.klinker.messenger,A Google user,okay I m leave review three star ill add specific app pretty much perfect area lack other integration use pc phone pretty much flawless there s decent customizability flexibility use pc awesome think app lot potential growth unlike textra pulse support io emoji customization option silly sound everyone know io good emoji think app like textra incorporate pulse especially give fact main goal emulate ability imessage send text pc add support include customization ill give five star easy buy app outright,3
348,xyz.klinker.messenger,Bryan Sloan,fantastic web message integration battery drain great search emoji use smile code phone app fast well lay feature request roll menu option web interface put conversation close top add gif search web interface spread web layout little bit expand screen rather center great work,5
349,xyz.klinker.messenger,A Google user,come back pulse google message message web great idea implement near well pulse motweb time disconnecting would able sendreceive message time pulse great responsive desktop app use window I m work pulse also allow text device google friendly kindle fire linux etc sm app phone work great feature customization set second none I ve especially make use delay send feature allow catch wouldbe unfortunate misstype feature eleven great value look detail app everything honest straightforwardly detailed hide cost surprise world app store refreshing concept,5
350,xyz.klinker.messenger,A Google user,get app stopgap verizon message bug pulse work fine though control notification would nice double vibrate can not change big loom issue io version understand that s devs fault cmon what s point sync device can not sync half device,4
351,xyz.klinker.messenger,Curtis Kinsler,design app amazing mms issue apparent year original developer day seemingly resolution maybe carrier deliver issue do not matter still issue do not happen use another app fix can not recommend use app,2
352,xyz.klinker.messenger,Andrea Yun,love app long send video text use able have not able month I ve try reinstall send small video file avail otherwise awesome app edit minus one star video still unavailable might go different app,3
353,xyz.klinker.messenger,A Google user,app amazing beat app ever use honestly feature purchase addon app absolutely everything free well equivalent everyone else combine set two thousand twenty could want archiving get swipe leave right dark theme default device easy change customize want privacy well that s secure area,5
354,xyz.klinker.messenger,V,I ve use app year pay subscription usually love recently constantly crash seem issue send receive mms message sometimes issue cause whole phone freeze I m sure happen wish still work like use,3
355,xyz.klinker.messenger,A Google user,good free app really like adfree I m glitch color randomize group chat I ve submit bug github issue tracker have not fix yet great app random color bit distract though I ve switch back app phone come,3
356,xyz.klinker.messenger,A Google user,far absolutely wonderful reason do not give five star have not long enough see something annoy app visually appealing lie wonderful like email folder archive text set repeat reminder people text customize contact color notification sound also use whole screen phone display message,4
357,xyz.klinker.messenger,Roger Asbahr,really nice app breeze use back rebuild text datum easily offer many useful feature oct two thousand twenty - one two year later absolutely love program many useful feature work reliably smoothly back restore text easily work simultaneously multiple platform give gift go pulse,5
358,xyz.klinker.messenger,Cherish Grabau,pay wish have not app usually work fine phone do not receive text get however main reason buy pulse readreply texts samsung galaxy active watch ipad unfortunately time neither feature work watch receive notification do not allow read text type reply send new text get notification dig phone web page chrome browser ipad do not let respond text sometimes let read text list ill keep give chance I m probably instal next phone,2
359,xyz.klinker.messenger,David Bascom,great standalone sm app good dark theme vibrant color customization superior android native sms app four texting device randomly need text browser key word randomly ninety - ninemonth pricy one two time I d need feature 36ninety - nine lifetime membership even I ve app week I m sure want spend much money 5ninety - nine lifetime instead yearly would do webwhatsapp copypaste success,4
360,xyz.klinker.messenger,A Google user,really like app do not suffer performance problem experience stock android messenger I ve since switch back however frequently run issue do not receive group text leave partial conversation indication I d miss message conversation seem weird make absolutely unusable need able rely receive message,1
361,xyz.klinker.messenger,Kris Wood,decide purchase adfree version recommendation friend love able use desktop phone even time desktop version limit size pic frequently send pic start get little glitchy find completely close window reopen seem get rid problem,4
362,xyz.klinker.messenger,A Google user,love app come across try get samsung active two watch send receive text work really well phone watch problem I ve send text leave open person I m texte expect response soon app notify incoming text person remember exit person name communicating order notify next text inconvenience need get use,5
363,xyz.klinker.messenger,A Google user,app meet three basic criterion one allow block number keep list block number two good interactive widget put home screen three allowd easily see time individual text send add bonus free add,5
364,xyz.klinker.messenger,Patrick Snowman,great want schedule message also great feature set delay several second adjust setting avoid oop moment accidentally send text you re do edit simple intuitive favorite sm far,5
365,xyz.klinker.messenger,A Google user,nearperfect overall pulse can not delete individual message conversationit delete pulse message remain stock app test android seven major flaw dedicate texting app surely fix soon would like ability use color wheel choose specific base theme daynight color override current whitebluegreen static combo change color app icon uninstalled try later keep good work dev,3
366,xyz.klinker.messenger,Dasi,use love app lose password use password reset option I ve try many time never receive email reset contact customer support send link email tell do not work do not get response except rate support receive open another ticket nothing frustrating do not want lose message block list especially pay service I m disappoint,1
367,xyz.klinker.messenger,Enid Gertmenian,use pulse offer delay send recently reinstall get desktop version work ipad pulse completely screw contact name mismatch number happen send random picture old text message random people contact extremely dissatisfied concerned affect business update huge problem unhelpful bot response customer support avoid app,1
368,xyz.klinker.messenger,Orlando Carrasquillo,almost month witthout resolution horrible customer service try correct issue account prevent able use multiple device text primary reason say year subscription try everything customer svc team recommend via email nothing work far also request multiple time number call speak human request basically ignore,1
369,xyz.klinker.messenger,Laura Kippen,app always buggy functional good enough buy premium license late act badly either receive text send can not figure decide work get bad enough feel need uninstall I m unhappy,1
370,xyz.klinker.messenger,Marsha HT,try new messaging app far pretty amazing nice interface love customization however one thing annoy interruption instance texte sister will not able text read incoming message continue literally stop texte force read message first go back texte annoying new message keep popping ask read,3
371,xyz.klinker.messenger,Z G,struggle sync laptop sometimes resynce cause data loss otherwise experience app amazing reccomend highly default message app could satisfied wirh powerful service flexibility goodlooke user interface provide,5
372,xyz.klinker.messenger,Book Of Oz Ozzy,solid text app need easy select personalization text alertsunique sound text do convolute specific text msg lock do not archiveoption add confirmation deletingtoo easy swipedeleteat least undo button show bit love office option pin important contact auto change dark nighttime color option use keyboard etc,4
373,xyz.klinker.messenger,Dominick Thompson,good sms experience I ve find android feature rich without bug there s scaling issue window ten app fix image resize problem occasionally irk webpc platform miss contact texte device occasionally desync bug send old fail message app I ve try match usability feature pulse continue use platform regardless occasional glitch,4
374,xyz.klinker.messenger,A Google user,overall pretty good app simple well fuctione downside way search text within convetsation search option show top main page get individual conversation search option go hope author could fix perfect app,4
375,xyz.klinker.messenger,Medium Chungus,subscribe pc access schedule message default message app handle problem deal image consistently sendingarrive clumsy sync stutter i d switch device constant image large I d try send nominal screenshot pc finally pull plug several thread disappear today archive go meh,2
376,xyz.klinker.messenger,A Google user,would not love give app five star really want work unfortunately many feature do not work possibly cuz I m oreo maybe cuz I m custom rom do not know default message app android issue big issue group message setting enable message group however reality send individual message triple check enable setting still work second go change ringtone change fine setting receive message remain default notification sound issue run really smooth really hope replace android message android messaging run smooth suppose keep search,3
377,xyz.klinker.messenger,A Google user,sync issue comp go whole delete account sync cycle least twox year be not great group message general buggy luke great job I m happy able text computer room improvement,3
378,xyz.klinker.messenger,A Google user,one good texting app available try everyone ability text computer work put top complain anything wish little ability customize conversation like change color send text bubble text color font etc minor gripe happy pay pro version,5
379,xyz.klinker.messenger,A Google user,everything expect sm app everything work good far recommendation option remove timestamp conversation list know texte someone today last week do not want conversation list clutter different timestamp texte someone,4
380,xyz.klinker.messenger,A Google user,design great simple use nice customization option definitely like app well one phone come default ad big plus complaint there s popup short cut reply message keep conversation open like messenger also send gif weird make send separately specific person ideally I d like tap one want use convo confirm send have not app week rating may slide half star definitely forty - five,4
381,xyz.klinker.messenger,slappyrats,love app sync text device device flawlessly schedule message feature amazing password get change account deactivate buy lifetime premium contact developer get account fix never respond do not want pay price even think love app work great help there s issue really suck hey get resolve app remember purchase make new account somehow would one hundred recommend beautiful app,5
382,xyz.klinker.messenger,Brad Barks,great app seamlessly syncs texts phone tablet text come phone show tablet text send tablet show phone phone work way normally would like feature allow naming conversation shorten name group member see header also name thread number contact,5
383,xyz.klinker.messenger,robert skoda,work great work kill restart sometimes several time day private conversation sometimes will not open click back forth inbox private box time least day open will not let click message thread till kill app restart great app suspect glitche due android twelve new update thing change,2
384,xyz.klinker.messenger,A Google user,many thank luke klinker develop stellar app use welldesigne app week happily pay lifetime membership one thousand ninety - nine wife pulse sm offer feature want long time one repeat alert option notification customization customization setting area set remind every minute two minute five minute one0 minute thirty minute hour text message do not notice have not read two ability easily find unread conversation three wealth nocharge feature make app clear winner four lastly pay monthly yearly lifetime subscriptionthe ability install use slick desktop version window macos linux desktop app alone make well worth price admission,5
385,xyz.klinker.messenger,Rich Brandon,pulse fantastic replacement google message switch message take away ability customize contact have not look back ton good feature scandal message unlike g message samsung use switch phone time retain sms history thank solid app personalization option have not use text across device sound great try app,5
386,xyz.klinker.messenger,Bluesjack Frost,excellent business tool excellent security klinker hit one park secure encryption transmission storage cloud permanently keep conversation folder permanent record whether change phone operate system smsmms messaging system perfect solution personal professional need,5
387,xyz.klinker.messenger,A Google user,good message app one longstanding fatal flaw need address there s sound notification individual text phone screen still show conversation example eagerly await reply janeset phone charge screen still conversation screen never turn charge therefore never get ding reply hour later I m horrify reply promptly never know please fix,4
388,xyz.klinker.messenger,Thom P,use pulse since host original developer klinker app use work perfectly totally bug free always stay sync device since purchase maple software ongoing problem primarily message stay sync among different device switch another crossplatform sm app near future,2
389,xyz.klinker.messenger,AJ Amaya,work great love schedule send text absolutely hate long take send text press send take twenty - three second actually leave text box send I ve already receive response contact make play catchup I ve check setting yes delay send set,3
390,xyz.klinker.messenger,Mr. Malignance,app quick able handle whatever throw exceptyou lock important message I ve look every option toggle can not find way lock single message deletion I m stick delete individual message nuke whole conversation omission get fix raise rating least four star like app super frustrating every time important text get erase,2
391,xyz.klinker.messenger,CJ Ortega,pay service work portion time set default send text always come back sendind fail mms do not send do not recieve incoming one sound great need update service improvement especially charge service get bad do not work message always fail mms fail well want make default prefer add work drop rating since respond either tell problem carrier,1
392,xyz.klinker.messenger,Chris McDivitt,inapp photo editor send break use able crop image select process send message select pencil icon edit flash editor do not anything please fix really convenient feature,5
393,xyz.klinker.messenger,Jim Hennigan,love app somewhere alomg line trouble send receive group text mms messagesand hit miss communicate apple phone user good chance change set even inability track glitch correct end flaw really do not want give imay steer clear difficulty probably five star app,3
