,Package name,Reviewer name,Review,Rating
164,xyz.klinker.messenger,A Google user,far good messenger app I ve find small complaint though feature wise miss search function two bug I ve discover do not update contact name group chat add contact phone sometimes continue say message send even recipient receive respond color feature get somewhat difficult make assign color chat instead contact mean group chat contact assign specific color match individual conversation color still google messenger remove ability choose color likely good messenger app market,5
165,xyz.klinker.messenger,Wayne Shelton Sr.,love ability text browser I m unable phone time love color code contact ina group chat never keep color color always change that s frustrating holiday receive group photo sure feel left family comment photo I m blind oh way pay lifetime subscription think good option available,3
166,xyz.klinker.messenger,A Google user,want message app work well pc desktop chomebook install app work course like quick key able toggle drive mode ability create folder assign certain contact private conversation require password fingerprint access simple clean interface enough customization option taste two thing really like webpc interface work really well quick key customizable allow write anything like office message let people text know you re available text back great app thank,5
167,xyz.klinker.messenger,A Google user,I m really like use sm across device main phone number work great much reliable hangout also look nicer customization hangout free miss notificaton dump pulse cost six per year eleven lifetime license use across multiple platform least work reliably I m sell it d free use phone,5
168,xyz.klinker.messenger,Cameron Gilbert,use app mostly love pick webpc ability work well time make convenient text I d give forty - five could web service frequent hiccup do not sync real time contact update always issue number still show phone number instead contact name overall happy,4
169,xyz.klinker.messenger,A Google user,app work great android seriously fail window ten machine contact support multiple time regard issue window app freeze support find solution proceed ignore shame pay full price two license app one one husband whole reason buy specifically cross platform communication,2
170,xyz.klinker.messenger,Bryan Pocock,love app love able schedule text love able get text device include tablet desktop problem mms stop send group text medium photo will not send appear relate sprint tmobile merger also app issue message app work time pulse switch back forth pulse support simply point faqs say busy help ok pay app,3
171,xyz.klinker.messenger,Rick Saletta,like feature include pulse app unfortunately app completely unreliable send message phone do not reach friend family desktop interface convenient respond message phone response visible browser version do not receive message make completely useless disappointing time quality test app,1
172,xyz.klinker.messenger,Dustin G.,overall bad issue persistent offer use pay desktop service apparent lack ability lock individual message handy want delete content conversation leave message hold conversation ready schedule message system clunky picture stop send one point do not resolve maybe be not issue end decide return previous app choice,2
173,xyz.klinker.messenger,A Google user,love transfer conversation new phone need pay upgrade version great flexibility outstanding though I m still learn couple year later swipe conversation archive accidentally swipe one do not mean recover course want permanently erase archived screen thoroughly enjoy,5
174,xyz.klinker.messenger,Steve Xu,add capability block sender group message recently many spam message like there s easy way block within pulse popup window turn feature samsung phone somehow long work pulse use developer return email really quick highly appreciated,5
175,xyz.klinker.messenger,Andrew Edmiston,love able text computer mac app hiccup may I m old os like option view unread message would nice option still show notification badge icon even swipe unread message notification center sure that s possible samsung,4
176,xyz.klinker.messenger,Frank Bertucci,work consistently well across device really aim limitation file size otherwise issue super fast ui look great easy use hope keep develop new feature time go example link call app call message would great,5
177,xyz.klinker.messenger,James Lakko,messing awesome good customization option wish could add background conversation though love sync device sync perfect especially wish dedicated ipad app app store get around instal workaround iphone app also wear os app do not seem use bluetooth pair phone seem need wifi,5
178,xyz.klinker.messenger,Bruce R,easy use free bug work well many include feature phone recently die message save cloud automatically transfer new phone instal app sign pulse account keep get well update move new phone new android ten operating system app work well app make transition easy,5
179,xyz.klinker.messenger,Robrit Johnson,enjoy basic like texte picture gif medium total crapshoot tend work even solid connection additionally use car bluetooth feature driving do not endanger other app appear work phone message app would receive message notify read aloud app supposedly drive mode notify work read aloud feature overall bad great,3
180,xyz.klinker.messenger,David Toomey,I ve literally try dozen texte app good period mute conversation instead specific contact block phrase filter limit spam text individual contact notification option sync across device lot I ve use pay version twenty - five year consistent reliable do not understand recent bad review I ve glitch love app,5
181,xyz.klinker.messenger,Pam Kilmer,far love search long time message app connect phone tablet finally find one price great still love app except someone send video horrible anyone know might get rid find another app work video twond review use since may last year one issue pulse work get figure great app,5
182,xyz.klinker.messenger,A Google user,find app useful several communication device app give ability see sm message across several device allow opportunity efficient organize response minor issue encounter far respond sm via phone pulse display number text also something do not mirror text across device even would recommend useful tool especially busy people,4
183,xyz.klinker.messenger,A Google user,lean mean drop android message bloat ninetymb pulse hand be not fast far good yeah android miss stuff pulse send quick message notification drop hold widget couple second option send appear helpful work thing hectic well see one hundred eleven thousand nineteen sunday five hundred fifty - six great great app work need attach photo less three hundredkb fast pulse permit,5
184,xyz.klinker.messenger,A Google user,great message app full kind feature do not even know miss user friendly customizable unique help organize message work great pair gboard try premium use across device sure great bonus already great app free version already go beyond expectation,5
185,xyz.klinker.messenger,Jim P,great able text device include desktop I d give five star pulse crash every day two samsung galaxy pad reopen also reason try attach file I m give ability attach real file picture emoji etc terrible small pain overall great app,4
186,xyz.klinker.messenger,A Google user,amazing sm app initially download default samsung app terribly slow pulse superior sm app I ve use year due customizability schedule text delay text group message mute conversation criticism far call feature sometimes want call person I m texte call different person contact person intend call highly recommend app,5
187,xyz.klinker.messenger,Jason Bull,text app choice year I ve since pay full version first download look app capable scheduling message send specific day time feature since appeal app customizable conversation tool option mark message unread pin favorite conversation view unread message also long use separate app back message,5
188,xyz.klinker.messenger,A Google user,pro great app fun useful lot customisation con would really like get rid today week etc message together separate bit buggy time I ve issue conversation stay private conversation folder randomly move back regular convo folder tired deleting account make sure convos would delete server restore emailpass past sm could restore may wait long enough though sure sometimes desktop app start startup window blank white screen restart app thought top left box empty namephone number would like put avatar something overall prob good sm application androidwindow user previously bring issue reality issue have not terrible deal also luke seem update app quite frequently fix thing along way well add new feature application truly way go,5
189,xyz.klinker.messenger,A Google user,download app build text message phone bland app allow customize color give warm feeling open plus find easy use rarely problem app I ve year issue ever send message likely service app last least ad attach would definitely recommend,5
190,xyz.klinker.messenger,A Google user,app give functionality oem app do not ability change font size color etc could even read text message new phone color scheme could not change want text message app put control plenty feature yet simple use pulse way go,5
191,xyz.klinker.messenger,Derrick,stay away great be not spend sixty - five lifetime subscription textsm app love ability text people computer tablet phone seamlessly be not great people start recieve textmultimedia text do not receive text luck draw communicate friend family coworker regret spend much money app wish could refund,1
192,xyz.klinker.messenger,A Google user,simple affordable support dev wish tiny bit customizable fluidity leave something desire overall can not beat app picture restore old backup that s ok use desktop app wonderful one time fee blow competitor water,5
193,xyz.klinker.messenger,LayZGames,amazing problem whatsoever amazing interface easy learn tool edit issue quality picture receive yes change max size max option still fuzzy would appreciate guy could look thx keep good work,5
194,xyz.klinker.messenger,Jack Murphy,need feature way skirt issue get message iphone user say john loved message would awesome possible pulse suffer severely message duplication bug two consecutive message say thing conversation refresh you ve experience you ll know different receive double text carrier bug clearly issue pulse I ve use pulse year highly recommend,4
195,xyz.klinker.messenger,A Google user,far good like schedule text send certain time know busy remember even schedule text send reminder update app tell text message go look be not anything new also really like option lock important message help prevent accidentally delete app do not get three star,3
196,xyz.klinker.messenger,A Google user,app great features group text link picture rarely get send recieve soon download new app fix buy lifetime subscription well waste money give feature uninstalle app previously mention issue anyway issue need fix,1
197,xyz.klinker.messenger,A Google user,almost perfect pick android partially fun experience conversation color code message update suddenly I m back boring sometimes confusing message app remind much imessage thrill find pulse web app work wonderfully love folderstructure app even pick accent color basically thank google force much well user experience pulse sm I ve ever two minor thing unless user error part would love pic group text next text bubble love able open link directly seem use upper right dot menu say open chromeupdate turn browser luke suggest work perfectly otherwise thank feature do not know I d need,5
198,xyz.klinker.messenger,A Google user,like conversation transfer new phone I m disappointed pay text anywhere version also think could assign color people group message seem randomly assign color time open app disorient you re look message bob message blue one day beckys message blue consistency would nice,3
199,xyz.klinker.messenger,A Google user,search work desktop version texting need search desktop version behavior intentional read search word search help document state plan change also really would like forward email option like mightytext spend lot time email helpful get copy text,3
200,xyz.klinker.messenger,A Google user,remove one star whole thread show desktop app even though open would like use long sm conversation contact do not even show contact list even though default message app really like interface issue receive message desktop app even though show mobile app have not miss message weird message never show desktop app,2
201,xyz.klinker.messenger,T. Stark,I ve use app year maybe two couple flaw make mediocre primarily select app scheduling function great forget someone bday message want send someone middle night schedule message file forget say three star rating represent ok loos point couple reason one group chat type message certain case I ve yet figure exact circumstance someone group send message message type erase type do not happen every time enough that s recognize threat two editing message couple line long schedule send folder royal pita can not see whole message therefore can not easily edit message poor work around use copycut function move one location want edit disable cutcopy function location edit pita twob edit message way leave message do not get want save option end loosing edit core sms function app good enough nothing special sm app come previous version android clean implementation overall scheduling scheduling function remove reason update reason use app,3
202,xyz.klinker.messenger,Robert Brend,love web app awesome probably send fifty text computer rather phone complaint contact sync web app often can not find new contact can not start conversation contact can not find end send on message phone sync work great passwordfingerprint protect private message section awesome feature,5
203,xyz.klinker.messenger,Laura Chalifoux,love app use phone tablet windows ten laptop send receive text whatever device I m work huge convenience lot customization feature extra convenience like quick share option sharing content android without open pulse app main reason switch pulse easily see receive group text I m less likely embarrass inappropriate reply whole group excellent app,5
204,xyz.klinker.messenger,A Google user,opensource stable fast customizable great desktop pc integration definitely favorite texting app couple feature would like ability compose long text large space separate popup window also friend text new number option pulse offer save new contact option update exist contact text app feature year,5
205,xyz.klinker.messenger,A Google user,great app far superior texting app though without flaw use daily laptop chrome browser cell make savingsearche text breeze issue storage etc main complaint lot contact simply pull one regularly use web app even refresh contact mobile app work fine example want text tim alexander web app start type tim nothing pop try everything get text tim reply problem name show obviously connect contact work fine mobile app desktop funcione small gripe otherwise excellent app,4
206,xyz.klinker.messenger,craig watson,I ve enjoy use post several year variety phone I ve upgrade phone samsung ultra twentyg app do not work well useful mother phone actually say do not work well try send message pc send message pc really clunky do not work great you re think upgrade samsung note twenty g would think twice update tweak pulse seem work fine thank guy keep post issue,5
207,xyz.klinker.messenger,Edwina May,finally message app ad sych android tablet w phone try every app avail none work need pulse well worth every penny lifetime subscription cost less two month worth other update 414two1 app quit sync phone several week ago I ve try every set possible do not sync send receive anymore app worthless tablet I ve lose money go uninstall,1
208,xyz.klinker.messenger,cydonius99,awesome sm app feature rich highly customizable day dust cobwebs stock message app turn emergency alert due unreasonable frequency irrelevance use pulse long feel like go back old house country barebone basic atmosphere drab interior lack plumb pulse vastly superior top five app quite time,5
209,xyz.klinker.messenger,Sujan Bryan,I ve try every text app one meet need especially love schedule text do not wake people ability mark text unread remember respond versatility format automatic response general per contact amazing pulse utterly way go completely free thank pulse devs,5
210,xyz.klinker.messenger,A Google user,almost perfect app everything could want message app except video sound clip send regardless size I ve try send dozen video recording people show they ve send nobody get fix you ll five star vote,3
211,xyz.klinker.messenger,A Google user,work fantastic far love schedule text I ve use frequently two week minor issue I ve periodically try share pic get send text screen there s picture send point click add attachment icon upload picture text screen fine minor issue great app,4
212,xyz.klinker.messenger,A Google user,annoying ad clean ui would great customization color bubble conversation easier select right really vague actually affect maybe like mood sm pick specific text bubble color vs person app preferred app texting edit quick bit feedback please reduce sensitivity swipe gesture delete thread way sensitive,5
213,xyz.klinker.messenger,A Google user,pulse intuitive reliable android message keep crash switch have not look back thing keep rate five star web app contact syncing process little complicated do not seem always work vast majority time have not issue,4
214,xyz.klinker.messenger,Agent Tomcat,"update fifty - two thousand , four hundred twenty - one app still do not ability save image message instead one time autosave everything background fact ability select multiple image ability forward entire message include image text pretty basic feature sm app hey devs manage make take ten minute initialize optimize app upon installation that s something",2
215,xyz.klinker.messenger,A Google user,far favorite sm elegant simple design work modern feature without bunch bloat like backup cross device capability complaint aesthetic interface constantly reassign color different conversation disorient new conversation introduce app close open,5
216,xyz.klinker.messenger,A Google user,good need work font size setting choice annoying problem main prob unlike message new msg persistent popup notification middle screen app well lock screen smsmms app ability jump external text editor write msg basic text editing feature else use full screen display msg write separate font size set,4
217,xyz.klinker.messenger,The Swami,use fantastic app service use texte desktop well phone unfortunately ever since pulse acquire maple medium transfer november two thousand twenty completely mess app point long function desktopchrome extension I m sure they ll reply say oh that s suppose worketc kid know bottom line work long functionality look something sendreceive text pulse use pc via chrome extension read review like one look elsewhere functionality work two month,1
218,xyz.klinker.messenger,A Google user,finally message app function flawlessly do not need internet receive send picture ad interface sensibly put together customisable feature know app work well free make want pay promote think ill purchase computer messaging,5
219,xyz.klinker.messenger,A Google user,"great able backup text message cloud switch new phone able download conversation new phone nine million , two hundred thirty - two thousand twenty update still amazing app big convenience able use web version allow use full desktop keyboard much easy type message",5
220,xyz.klinker.messenger,Paul DuVal,excellent app perfect android sm alternative standard samsung sms try google message keep crash other either do not feature want many ad like function custom text notification tone enable option app also like message schedule pin text contact custom interface different contact able title group sm,5
221,xyz.klinker.messenger,A Google user,love customization except force dark blue background real though good customization message app also super fast never crash love one star short perfect mainly integrate camera distorted galaxy snine actually I m go to bump back five star lot really good feature app do not think,5
222,xyz.klinker.messenger,A Google user,fairly useful thought I d use instead android default hope step alternative simply basic message app big gripe separate text message people photomedia message split two message section everyone message much keep track also reliable identify phone number know number,3
223,xyz.klinker.messenger,A Google user,like option give edit style accord preference two thing I d prefer app first would nice image individual texting alongside text send second would nice app upload text past week,3
224,xyz.klinker.messenger,Sebastian Coeme,really high hope app love functionality perform various platform close suggest employer purchase multiple account would able communicate team effectively type review web app pc yet stick load screen top contact list populate correctly force create draft phone type pc concept great quality software server could use work give one start lose business disappointed expectation complicate reset function lack connectivity four reason four star deduction,1
225,xyz.klinker.messenger,A Google user,I ve use app several month enjoy much buy subscription wife device clean simple work everything pc chromebook tablet phone function able delay message feature use regluarly work want forget send message thought want send early morning late night fcc change way sm message think time seriously start think use nonstock message service one main contender,5
226,xyz.klinker.messenger,Jeff Hall,app really good love use love customizable color scheme rule pretty dang close apple message system across device however give four star find several bugsglitche use example even though edit contact name save still show previous contact name save rarely message shoe send twice show remove still think app great use,4
227,xyz.klinker.messenger,CLE Momma,always love app pay amount frustration app give photo medium can not handle anymore lol photo send contact twenty - five time majorly compress arrive constantly ask people receive photo send you re someone send lot photo app may love app color change theme great function low,1
228,xyz.klinker.messenger,Steve Gergetz,main reason use pulse browserbase web access able send receive text message windows computer that s massively important vast majority app claim stink I m give three star though contact synchronization web app unreliable klinker really need work also minor mark wonky copy function try copy text past message phone,3
229,xyz.klinker.messenger,A Google user,pay feature send receive message device use good use love great get send message onfrom computer message do not show computer pulsesm site time do not load recently could send message will not actually send hour two later be not like phone anything start notice would phone hand pulsesm open use web interface send message would not send hour later would finally send really disappointed pay one thousand ninety - nine something do not even work right,1
230,xyz.klinker.messenger,A Google user,I ve use app long time always love however month message come delay many time picture send will not download show uninstalled pulse week use different app do not experience issue love pulse much reinstall week immediately experience exact thing still one well sm app available though,4
231,xyz.klinker.messenger,S Servin,update thirty - two thousand twenty - two app become unacceptable grammatical error add word randomly send switch different app exceptional look good simple message app pulse great allow delay message second schedule message use microphone message really good quirky issue problem,2
232,xyz.klinker.messenger,A Google user,app great wellmade everything streamline colorful easy use one feature do not like app delete message texte app delete message person pulse smsit break text message day go back every single day manually delete every message,4
233,xyz.klinker.messenger,Danielle Ross,edit last week pretty buggy message will not send clear cache sometimes history incoming message roll dice duplicate list new message day read get kind annoying love pulse work desktop multiple phone tablet watch,3
234,xyz.klinker.messenger,A Google user,eleven one time fee can not go wrong app love much make complete sync among note eight galaxy tab sfour windows pc delay device sm mms sync flawlessly also support korean huge plus multiline message display fine person use call text message comminication client like app musthave whatsapp kakaotalk line message app good client use one app go back forth three app therefore basic text still good place communicate store conversasion client conversasion sync among device can not happy thank,5
235,xyz.klinker.messenger,Kirk Gibson,work well suddenly problem send receive picture delay pic wotn send large will not autoresize give option resize also sometimes contact will not show even though actually list messaged try sync contact simply can not understand try sync do not match number,3
236,xyz.klinker.messenger,Amanda Donathen,texte phone app okay nothing special specifically want also able see respond text computer could not get work login info do not work even try suggest step trouble shoot I m go back default message app,2
