,Package name,Reviewer name,Review,Rating
237,xyz.klinker.messenger,Shelli,amazing app user friendly customizable far good sm app completely free ad feature would like see ability lock specific text msgs app option say lock whenever tap hold individual text message way wish delete entire thread message include leave lock message delete rest deal breaker mean would useful,5
238,xyz.klinker.messenger,Matt Buckley,good feature use often delay send sync watch pc buggy do not really seem update much anymore I m new set phone experience issue previously blame old phone use impressed pc app still crash wear os app do not always sync notification disaster especially later version android bubble messaging issue might make,3
239,xyz.klinker.messenger,A Google user,get new moto gsix find native verizon message app keep give false notification combination light flow try texting app be not satisfactory great app love set repeat notification uninstalle light flow would give five star option insert bitmojis press attachment option update change keyboard gboard able use bitmoji however realize could set individual contact text notification tone current conversation conversation delete individual text sound add sm popup permanently assign different tone contact update sm popup stop work hunt something else try mood good realize individual contact alert sound do not work text include people I ve phone almost five month still can not find text app everything need,3
240,xyz.klinker.messenger,A Google user,perfect execution clean fast exactly suppose well keep note nine tab sfour perfectly sync make lte tablet lot useful afraid stuck verizon bloated date message app multiple device sync find pulse immediately pay lifetime subscription well do,5
241,xyz.klinker.messenger,A Google user,message app great enhanced feature builtin app offer want charge far seem less I ve inocompatilibty issue app one downside I m fan force save datum yet another cloud also recur fee albeit small reasonable annoying prefer open end donation superior product people respond accordingly,5
242,xyz.klinker.messenger,A Google user,gladly give app well rating add option customize send message color default color background whether choose light dark grate eye literally go back phone default messenger give headache here hope well update,2
243,xyz.klinker.messenger,A Google user,try every app sun either miss critical feature like able simply sendreceive picture make app unusable subscribe friend be not truly open architecture app come close verizon message work phone disaster desktop pulse absolutely brilliant flawless app everything want share phone desktop aaa five star,5
244,xyz.klinker.messenger,Bernard Gray,love app issue would like custom folder main screen instead access side menu would also like copy text functionality allow copy text directly message instead highlight message select copy select portion message copy,5
245,xyz.klinker.messenger,A Google user,app well one want send message computer phone ived use mightytext mysm message web google sendleap pushbullet pulse pulse far well sync fast great user interface boot wish customization vibration sound like textra thing really hate search function web terrible search seventy - five conversation developer know plan change wish option able search message even sacrifice privacy whatever even mean day pay lifetime membership would pay get well search feature,4
246,xyz.klinker.messenger,jmh2137,pulse option I m look text web rename group chat pin contact top recently start look alternative sm app be not send receive text literally take three day everyone receive multiple message one time initially check provider say could see message sentreceive use group chat work reliability important,3
247,xyz.klinker.messenger,A Google user,like app except do not always leave time stamp last person text also requie one extra key stroke select name text go edit screen also send video clip couple minute long upload youtube send link instead would like able select group name via check box instead one time build group list,4
248,xyz.klinker.messenger,Kate Sanderson,nice customizable app enjoy web integration little glitchy you re type draft message switch another app keyboard do not close slightly annoying pretty great have not decide ill purchasing trial yet,4
249,xyz.klinker.messenger,Jacob Bell,bad texte app handle group message personalize setting well qualm pulse inconsistency file sharing send picture gif always show end send sometimes never receive app also change notification setting back default times tiresome reset personalized text tone besides couple gripe still solid texting app work efficiently,3
250,xyz.klinker.messenger,Michael Levine,well great feature theory week half I ve switch pulse apparently miss bunch text least twenty - three people know many weird bug would send computer message disappear do not show conversation either phone computer yet friend say get abort since unreliable,2
251,xyz.klinker.messenger,David Alves,love pulse great customer service love organize text group actually block user persistent report I m sure there s love unfortunately do not spend much time texting explore feature I d prefer video show everything I m tired reading description,5
252,xyz.klinker.messenger,Scott Cates,"good job replace stock android six message app reliable backup system onetime purchase fee automatic backup worth fee app slightly rough around edge user experience quite polished stock app though edit nine million , two hundred forty - two thousand twenty five star restore message three phone chrome access easy klinker seem care schedule message work great I m ui tester work fine",5
253,xyz.klinker.messenger,Dale Parks,great many level would give five star would provide spell check underline red ask times use pulse quit recently download one thing like bring clipboard item phone original clipboard message important technology feature add beyond ability understand can not provide spell check least thank u,4
254,xyz.klinker.messenger,A Google user,text send pc send sometimes show chrome go android text be not even wonder people be not respond text discover carrier issue major bug pulse complete deal breaker one issue look back happen month,1
255,xyz.klinker.messenger,Jim Rigsby,use app instead phone builtin sm one reason able sync pc type full keyboard copypaste text nowadays pc version display every active conversation display delete conversation also display conversation often skip text yesterday try use pc click long url display type url manually,2
256,xyz.klinker.messenger,Dave Zucker,purchase lifetime subscription love app last month I ve several issue contact do not sync desktop use miss part group conversation other group inability see photo video message try different app switch back pulse start resende entire text history hundred message minute year resent there s kill switch account do not know reinstall,2
257,xyz.klinker.messenger,Ken Castania,do not work consistenly instal program two device work tandem usually do not work experience help information seem think always offer little insight nothing work fix usually mean delete account reinstallingjust sustainable wish have not go upgrade versionjust waste cash,1
258,xyz.klinker.messenger,A Google user,really enjoy get msgs device pay pro version get message computer tablet really hate try compose darn phone much prefer use keyboard issue I ve message do not display picture view tablet computer though I ve contact developer do research go dis,5
259,xyz.klinker.messenger,Jimmie McFunfloungel,windows version app would sync tinker get working seem unreliable far poor antispam come google message app comparison do not spam control message appear default limit contact automatic spam filtering,2
260,xyz.klinker.messenger,A Google user,try several email app like one good fast flexible have not find downside use verizon message limit use default notification sound want separate sound message pulse let kudo pulse team know customer want,5
261,xyz.klinker.messenger,A Google user,work want message system be not necessarily social medium base want seamlessly use read send message across device include pc app deliver wonderfully also worth money get exactly want need love do not lose correspondence device bravo developer,5
262,xyz.klinker.messenger,A Google user,especially like delay send text second cancel text there s something wrong keep accidentally send partially correct message I m try edit like ability archive message wish way save favorite contact however want send message someone start type name search,5
263,xyz.klinker.messenger,KK Kriv,there s always confuse hitch get new device app much confusion discover new device transfer everything well continue backup upload pc also switch phone default message app switch back process force old photo file message resent contact really really annoy otherwise good,4
264,xyz.klinker.messenger,A Google user,pretty great message app main issue none newly save contact actually update message ui save contact phone still display number text message update dev I ve try several time work half time inconvenient force close app every time need save new number see name I m honestly assume compatibility issue phone,3
265,xyz.klinker.messenger,Joe Chilbert,pretty solid little overwhelming take time get use many feature email service impressive wish way send message via datum be not stick use thing like facebook messenger I m wifi bomb shelter thick building also wish way pasteinsert quick section kind like email signature preset phrase need type time,2
266,xyz.klinker.messenger,A Google user,good love app right away already sign device sync really hope service stick around continue improve sure android allow would love phone call could handle app sync across device well apple ios mac example device sync automatic sm backup amazing definitely worth low price many thank developer,5
267,xyz.klinker.messenger,Libby S,update complaint web interface require use ipad tiny bit well still hard use original one thing aware world ipad web application clunky slow see message even send one eventually try avoid use android great fine macbook,4
268,xyz.klinker.messenger,A Google user,much trouble google message web computer would log log back send receive message pc frustrating imagine try many thing suggest decide try another message app offer ability work pc soon download start use pulse problem solve use five day without single issue extremely satisfied grateful find make manage message breeze pc phone part app beautiful they re pleasure use give five star,5
269,xyz.klinker.messenger,RJ Dunn,pretty good wish could add conversation multiple folder wish folder one click away big annoyance though can not easily send text multiple people individually set change global setting lot good sm app one none compile right feature one like name group convos good auto response feature look run smooth,3
270,xyz.klinker.messenger,A Google user,ap say real time test time time phone tablet side side ill send text phone bam pop right tablet texte tablet web one improvement need behind scene change phone stay connected could not sync message get new phone could continue send do not show other confusing get help faq,5
271,xyz.klinker.messenger,A Google user,app awesome get tired google message drop connection web client constantly pulse lot stable regard way feature google message love schedule message function ui general great good alternative texting app I ve find use two day sell buy lifetime license keep great work,5
272,xyz.klinker.messenger,A Google user,great app concerned app invade privacy use default app use without issue concern simple color scheme customizable contact well notification ability backup text another device phone require payment really like feature able see message work computer tablet respond without pull phone much like whatsappfacebook hangoutsgoogle without big brother watch,5
273,xyz.klinker.messenger,lee perez,everything I ve want several different messenger one complete messenger even message computer great case ever forget phone somewhere thing do not like can not put picture conversation background android phone customization feel kind important texte experience,4
274,xyz.klinker.messenger,Dow Wilson,really enjoy app perfect access text computer well interface still need little work would nice able create group contact list single click availability text video seem also problem web app work fine mobile overall recommend app,4
275,xyz.klinker.messenger,A Google user,message app eclipse sm still nice app allow access sm message mean phone think fee associated service still worth pay feature game changer though question niche enough least ui simple beautiful offer something competitor do not seem like five star app,5
276,xyz.klinker.messenger,A Google user,pulse app several month I ve try sm application favorite far pay version sync perfectly desktop laptop would recommend anyone desk job would rather type text use phone work fine phone I m fast type actually texte,5
277,xyz.klinker.messenger,Hoppy Sparkles,download rec go samsung watch three impress far least share message complaint be not icon show top everything else spite allow top link text eg petsmart joann link broken go page simply say joann petsmart also setting would like control learn live without month may go back mood,2
278,xyz.klinker.messenger,Jason Hudson,think good app dislike do not like step need log can not remember password backup everything would still like able save everything file pc accidentally make two account first oneyear subscription twoend lifetime subscription would nice join two together end,5
279,xyz.klinker.messenger,A Google user,superb app ability define text template modify they ve select incredibly useful least professional driver need large inventory reusable text airport pickup different terminal etc first class well worth pittance charge lifetime subscription would nice ability report incoming text spam one native android texte app perhaps add time,5
280,xyz.klinker.messenger,Jean Roth,"update one hundred thirteen issue send photo many never go message mac often appear pende send wishlist item wish could mark text like etc pay subscription look alternative bc photo issue problem one thousand , two hundred twenty love able text across device however I ve lot issue lately app refreshing show new message photo often do not go certain medium can not send well",3
281,xyz.klinker.messenger,A Google user,amazingly powerful app never performance issue responsive simplistic decently customizable buy lifetime subscription text device have not single issue regret purchase definitely see use service long time come,5
282,xyz.klinker.messenger,Mike Rush,absolutely good sm app loaded feature solid especially like feature allow set delay timer text send time read catch last second mistake mine set ten second also like ability schedule text delivery great app,5
283,xyz.klinker.messenger,Jesse Stevens II,name,1
284,xyz.klinker.messenger,•Gefroren •,use run perfectly fine can not see entire message history example message go back august be not anymore stop week check default messenger phone they re still pulse do not show entire messaging history whatever reason hopefully bug fixed app work well otherwise do not duplicate message bug describe fix bug please,3
285,xyz.klinker.messenger,BR Cope,great simple texting app load feature advantage user friendly intuitive text conversation feature link great aspect importantly open source private signing account worth inexpensive consider extra feature plus message automatically back love,5
286,xyz.klinker.messenger,Jon W.,maybe miss something can not seem find way set individual notification sound contact also mislead set sound effect call send message sound even annoying sound either can not change rest app seem pretty decent though like well textra android message need little customizable look little polished get five star rating,4
287,xyz.klinker.messenger,RYAN SIMMONS,pay year subscription march thirty - one two thousand twenty - one march thirty - one two thousand twenty - two get primary use window text synchronize phone thought subscription end do not give another thought stop work month subscription actually end would say login error say subscription end get charge next year contact twenty - threerd response cancel google four day later get refund thank goodness google allow refund go email pulse twenty - nineth say cancel could help person complain login error windows app lot glitch always send text hit enter synchronize well would give app three star slow response developer get one star,1
288,xyz.klinker.messenger,Rod Hill,work pretty good part lot feature available increase usability issue attach multiple picture text message may wrong usually try tap one pic tap next pic I m back message,4
289,xyz.klinker.messenger,Seth McDonald,love app eventually start drop quality video send picture video stop send completely switch back old default message app pic video go problem big enough problem stop use app that s otherwise great hope get fix,3
290,xyz.klinker.messenger,A Google user,app work prett well time smartphone side first issue support native ipad app something think website kind misleading say ipad support second issue cloud sync awful half message do not sync cloud see phone third issue use google assistant send text text show pulse anywhere,3
291,xyz.klinker.messenger,A Google user,app like imessage android everything work really well include online sync sm message google message ok free alternative even close update message quickly without issue I m think buy free version good enough switch,5
292,xyz.klinker.messenger,A Google user,really like integration use tablet phone I d really love customization however especially look feel switch textra use long time free pay awesome app integration would love customization level textra definitely would earn five star,4
293,xyz.klinker.messenger,Au. Ch.,issue account do not expect support ever contact back think want people lose pay feature make rebuy new subscription model pay one hundred ever since get buy I ve issue app do not think original developer work anymore anyone matter you re well use different texting app support computer access shame go sm app,1
294,xyz.klinker.messenger,A Google user,work ok miss function app little clunky I d like see window platform include choice popup remain screen acknowledge sometimes do not see text late notification stay second clunky window app desktop take forever open select text,3
295,xyz.klinker.messenger,Billy Willoughby,look replacement stock message app first one thought chance big complaint stock app fact compress picture send via mms androids family do not one web interface work want actually tell send message recipient never get later check phone never show phone can not trust,2
296,xyz.klinker.messenger,Jonathan Jeffries,well default texting app without issue integration os ideal think due android make hard integrate send via menus app etc work well previous phone lg vtwenty well pixel threea xl still well native app tho,4
297,xyz.klinker.messenger,A Google user,really like feature sync device backup wonderful nice talk desktop type much quick luke klinker wonderful come need help need assistance time get thing work almost immediately app use pulse prefer texting several year do not plan switch like dark option aswell easy eye keep light away,5
298,xyz.klinker.messenger,A Google user,miss background photo customization that s deal breaker would make app elite also do not notice assign message sound individual perhaps miss think app phenomenal especially get text device allow turn phone completely charge sometimes worth get alone I m extremely impressed,5
299,xyz.klinker.messenger,Susan Paul,really cool app like schedule super convenient one area improvement able share medium schedule text have not work properly free version image be not include text send overall useful would recommend,4
300,xyz.klinker.messenger,A Google user,app amazing allow archiving clearing inbox without actually delete message pretty basic feature sm app do not allow scheduling message include group text also texte pc reasonable one time fee thing would add web messaging make tab change notification new message arrive,5
301,xyz.klinker.messenger,Razzano Family,lot thing app many other can not like pin important conversation like there s web base version like schedule conversation later date difference interface wish do not exist update much still hold true want add contact sync do not always work frustrating resync message clear setting,4
302,xyz.klinker.messenger,Tracker Scout,one good love open browser pc share link photo text receive text wish though sharing youtube video would write name song along image like many message app great show imagethumbnail preview videosong though love pin important people top love call someone quick button text texte someone one good sm app,5
303,xyz.klinker.messenger,Olyver Thew,work well relatively customizable schefule message archive block number mute conversation also use gif various medium message send wish could change background text log set personalized message notification ppl change color message bubble overall great work app issue,5
304,xyz.klinker.messenger,Steve Day,rarely rate app case app work work perfectly across device other like miss boat big time developer take time respond message welll get good help possible source get update thank resolve issue able use web browser access,3
305,xyz.klinker.messenger,Chris topher (Computer Chris),fantastic app watch gear os could fast start well claim default sms status overall useful juggle multiple device suggestion box fail message stand separate notification category one mark clearly important critical perhaps even category side bar menu along side private schedule folder list,4
306,xyz.klinker.messenger,Anthony Agu,terrible can not send message ten people buy app l send message large group uninstalle instal app however problem still persist app great feature practice app work contact support severally help able resolve issue message app app can not send message,1
307,xyz.klinker.messenger,Nat,really like app wish way turn thumbnail video send edit app be not work properly nowadays photo do not send properly often can not switch different app cause bug default message every photo ever send contact resend simultaneously nightmare,1
308,xyz.klinker.messenger,MM Ahmenatu,omg app fire download quite schedule app crazy ad embed message constant busy screen although twenty - fourhrs everything app promise actually schedule message email like way app emulate original phone texting interface make easy use within second lastly like option message organize time send must app,5
309,xyz.klinker.messenger,Nancy Williams,like pulse except show first name group text accidentally send message group intend send individual people dangerous potentially embarrass one many time switch verizon app make much easy see text group text please fix problem ill come back otherwise like pulse well,3
310,xyz.klinker.messenger,Jaque Elf,concept great application lackluster good do not sync consistently accurately across device seem lag often hit miss send pic linksi start month month subscription could real world experience see well app performance across multiple device currently do not think ill upgrading lifetime do not work well ill give one month see improve cancel subscription leave,2
311,xyz.klinker.messenger,A Google user,almost perfect user come ios environment thing miss i d like see time stamp message send recieve ios simple tap message slide leave reveal stamp thank seamless transition keep good work update stand correct app flawless,5
312,xyz.klinker.messenger,Krystal Geddes,love app first soon start pay start messing would not receive message recipient would not receive message stop work soon open close say pulse keep stop yet continue charge every month even though explain creator ask cancel wish app work way begin extremely helpful shortterm memory issue due stroke,2
313,xyz.klinker.messenger,Omar Romero,I ve own app least two year simply outstanding great customization option do not bother try sm app ability use computer web browser invaluable lately every able send picture text send receive picture uninstall reinstall work fix problem week,5
314,xyz.klinker.messenger,Nicholas Ferrari,seem great give five star bc expensive do not pay show annoying overlay ask upgrade do not like ad do not like subscription model onetime purchase price insanely high sm app awesome although wish could change font color color text bubble conversation,4
315,xyz.klinker.messenger,Rachel,great texting app easy use great customization option love able text computer wish do not quick send feature send photo since actually add unnecessary extra click select want send photo that s literally criticism edit quick send feature sharing photo show separate option must google photosandroid os update,5
316,xyz.klinker.messenger,Brodie Gullic,one hundred twenty - eight lifetime membership bug recognize anymore reach support try resolve issue manage fix actual problem love texte application do not waste money will not receive service pay update thirty - eight fix communication month even reach try resolve issue go back default texting app,1
317,xyz.klinker.messenger,Reese Hawk,solid experience great interface app desktop complaint stuggle send medium sometimes have not able work trigger sometimes photo will not go picture iphone come compress wise everything work exactly expect,4
