Package name,Reviewer name,Review,Rating
com.p1.chompsms,David Karr,"I've been using chomp on my Galaxy note 9 for quite a while. I have custom sound notifications set at the top level, and for several specific numbers. As of a couple of weeks ago, the sounds stopped working. Curiously, the same thing happened with Whatsapp at the same time. However, the Samsung messages app works fine. In both the chomp and whatsapp settings, I can verify what sound I have configured and hear it, but when a message arrives, it only vibrates. I have tried rebooting.",4
com.p1.chompsms,Jill Cowan,"I have been using this app for years, like since the beginning and have loved it and never wanted anything else. When the Android 13 update rolled out, it really messed up this app. My phone no longer lights up when I get a text, which is a real problem. I depend on that setting. This app needs a serious update to catch up to Android 13! Please fix ASAP!!! My phone is lagging and half the time the app freezes and I can't even open it!",4
com.p1.chompsms,Stephanie J,"I absolutely love this app. Very easy to use and does so much more then the basic sms app on my phone. I love the delayed send option, it's great for reminders to friends. I have to say I used the free version for about 2 hours and then purchased the paid version. Not because of ads or anything like that, instead, I wanted to support a great product and this is a great product Edit 11/28/22 I've been using chomp for two years now and I still love it.",5
com.p1.chompsms,Mike R,"The option to change the notification sound needs to be more easily accessible. It's pretty tucked away and kind of hard to find. The same with changing the fonts. The app scans for fonts and shows you what applications there are, but to actually change it means you got to go into the conversation view scroll down to outgoing messages and then see the fonts there. If the option to scan for font is easily to find, then the option to change them should just be included right there.",3
com.p1.chompsms,Virginia Mayberry,"I've been using Chomp for several years and I love it. However, I'm starting to get mass spam texts that have multiple other phone numbers attached to it, and there is no option to add the original sender to the block list. If you were able to add the block list to the menu, after long pressing the contact info from the chat bubble, it would be super!",4
com.p1.chompsms,Kayla W.,"An amazing SMS app. The options to customize the aesthetic elements are simple yet thorough, and the ads are completely non-invasive. Literally my only gripe is that the message notifications take up half the screen, but it's an incredibly small price to pay. Speaking of small prices, the one time payment for ad-free experience + extra themes is literally $5 plus tax. Totally affordable if you ever have any extra spending money, and yet not necessary to improve your experience! I love this app!!",5
com.p1.chompsms,Derik Arendall,"Only issue I've really encountered that I can think of is sometimes the text notification block doesn't go away after opening it, and will need swiping away in the phones notifications list before it really goes away. Aside from that, it's a great app with a great breadth of customization options perfect for anyone that wants to play with different aesthetics to their texting UI",4
com.p1.chompsms,R honda D,"I love the features but for some reason or another my messages are not being sent or received at times. Then all of a sudden I get them all at once. This just started happening about 2 weeks ago. Any suggestions. Other than this hiccup, this app is amazing! Update: per chomp, this is as a Samsung update issue. Reset network settings under general management.",5
com.p1.chompsms,Melissa Gurney,Been using about a year and it was easy to set up and pretty intuitive except for being able to voice text haven't been able to figure out. Another bummer is you can't send videos. I've tried sending 3 second videos get an error message doesn't support. Other than that great app!,5
com.p1.chompsms,KENNETH MCGHEE,"I have used chomp on a daily basis for the last 5 years and I find it to be much more feature rich than the messenger apps preinstalled on my Samsung and iphone. Besides Chomp having more customization, the ability to schedule text for delivery the followng day is a game changer for me (are you listening Apple). Also I love how easy it is to backup & restore previous messages.",5
com.p1.chompsms,Jayden W.,"A finicky experience. #1 there isn't even an app-wide dark mode. #2 I have to manually select delete multiple in the 3 dots menu, very inconvenient and slow. #3 very slow... Overall not looking too great. Either the developers have odd preferences or not enough effort is being put into the design.",2
com.p1.chompsms,Brandi Darlas,"I usually use textra, but currently it's having some issues. Wrote a review on it. Switched to chomp for now. Issues found: #1 unread dot isn't staying the color you set it. Reverts back to it's original color before you can save. #2 When in settings it still has the original white/green background, it doesn't take on the theme that is set. Not sure if it's a Glitch, but the white is hard on the eyes. Dark mode is best. Even a light gray would be better. Please consider fixing... Thank you.",3
com.p1.chompsms,Rob S,"It would really help if you LOST THE ADS. No one wants to see a fake message from Ashley furniture pop up on the message list. I sincerely doubt anyone is actually clicking the link anyway. I also don't like the group text or picture message functions. In group text, there is no way to send individual messages; they either go to everyone at once or not at all. Also whenever you get a picture message, the app doesn't work. You don't get a pop-up notice, it's like the app doesn't know what to do.",4
com.p1.chompsms,Natural Nashuan,Excellent. The ads aren't intrusive and actually interesting. It's better than the Google texting app that came with the lhone because it allows single texts to be deleted without deleting the entire conversation. Easy to use for sending photos though writing space is limited. I haven't had any trouble with it at all. Three years later I'm still pleased in 2022,5
com.p1.chompsms,Ian Icecaster,"It freezes up every so often and asks if ya wanna close it or wait. I like the app, and it's by far above and beyond the other apps, but still it has issues. I typed a LONG MESSAGE to my girl, and it refused to send it in an SMS or MMS version, so I had to take a screen shot of every paragraph and sent the images to her, for her to read the entire text. I'm shopping for a new app, but using this one because I paid for it and when I find something better than this, I'll dump this and move on.",2
com.p1.chompsms,LADY. S,"I've been using Chomps for over 10 years I've never had any issues, but for some reason, I've been having some major software problems with this app. I can't delete none of my messages through the app. I uninstalled it then deleted the message on my original app then I reinstalled chomps the messages were still there! I really like this app because of the ""signature feature"" but I think I'm a have to look for another messaging app until chomps fix the issue.",1
com.p1.chompsms,Allendefullism kin s s hi,"It works fine. The default samsung texting app requires you to press ""view more"" on longer texts, which I was not having, and while using google's texting app I repeatedly had texts sent to me that I never received. I have had one pretty major problem with Chomp. This review only allows 500 characters, so to cut it short: i was not getting popup notifications from chomp for over a year, eventually I discovered I had to go into my phone's settings and like 10 screensinfoundtheoptiontoenablethem",5
com.p1.chompsms,Layne Erdman,"So chomp wanted me to update my review, I've been using it a few years because tmobiles text app was terrible. Chomp is a good basic app. Kind of no frills, no fun stuff like Verizon gives you regularly with emojis etc. But stable and reliable, what I miss most from other platforms is search capability. you can't search a particular conversation or search just photos. it's very limited but it does the job.",3
com.p1.chompsms,Private Party,I gave it 3 out of 5 stars because: 1. The font size is small and you can't change it; 2. I couldn't find the Block Sender option But I did finally find the feature to lock a message or image - it comes on after you select the image or text and another menu appears with things not listed immediately under its Settings.,3
com.p1.chompsms,Jackie Kidwell,"I needed to find an app due to my msg app on my phone no longer made group text possible. Responses came back not within the group. CHOMP was the second download I tried. Works flawlessly. Not only for groups. After about a week very small adds appear at the top, but they are not intrusive. One thing I do wish the app would do is to be able to sort contacts into categories such as favorites, business, clients, etc. For now you can pin your favorites to the top of the list. Thank you Chomp.",5
com.p1.chompsms,Randy Borow,"Samsung Galaxy S21 Ultra here. For the last few years this was my favorite SMS text messaging app. Unfortunately, that changed about 2 months ago. For some inexplicable reason, none of my outgoing messages using Chomp are received. I myself can receive messages, but when I send messages, none of my recipients get them. On my end it LOOKS like they were delivered, but none are. I've tried every fix there is, but nothing works. I simply cannot use Chomp anymore.",1
com.p1.chompsms,MoonMuk,I used to love this app. Used it for years. It's the best customization app for sms. But it recently messed my whole life up because I was not receiving important texts and it wasn't sending half my texts and I had no idea. Now I can send ten one word texts in a row to a phone and the person wont get a single text and it doesn't even say error. So I can't use this app anymore and I don't think I could trust it ever again. :(,1
com.p1.chompsms,Pamela Holmes,Great texting app Love the various colors and backgrounds that you can download. One of the few apps that allows you to have a signature at the end of your message. Also love that I can send group text. My previously messaging app was causing issues. I also like the ease if use.,5
com.p1.chompsms,Phil Loyd,"As a trucker, I could really use a voice recording feature. The ability to send and receive voice texts, rather than pulling over so often really is a big deal. An app that I previously had would do that. It allowed for up to 60 seconds of voice recording time. Please add this type of feature, and I will gladly up the rating to 5 stars. Everything else seems fine. Thanks",2
com.p1.chompsms,Jaye Eryk,"Every time I customize for my own ringtone or use a different theme, I lose the most critical points of a text app. I get ZERO notifications! After a couple of days of it working normally. I get NO audio alert when a text comes in, NOR do I get ANY sort of notification whatsoever. I have absolutely no clue I ever get a text which renders this app completely useless and uncustomizable! However, if I leave it alone, which I hate, it works fine.",2
com.p1.chompsms,A Google user,"Overall excellent messaging experience. The extent to which one can customize that experience is great, and this opportunity contributes greatly to the feel of the app. The only issue is the ads. While mostly unintrusive, if the app loads late it may push down a conversation that you were just about to click on, causing you to click the ad. This is but an infrequent, minor, and avoidable problem. However, I wish there were options for customizing the size and shape of the quick-reply popup.",5
com.p1.chompsms,Natasha Prentice,"Great app. The ads aren't invasive at all. Wish I could personalize the message alert tone for each of my contacts, but other than that, it's a great app * Replying, I did as recommended, but the screen shows white and at the bottom, the options to save or cancel. When I choose save, a message flashes telling me to enter info to save. It's not working.",4
com.p1.chompsms,A Google user,"I was looking for a new app to send messages and photos because the app that came with my android phone stopped sending photos, and I found Chomp. So far it has been working great, and after downloading 2 extra accesories I customized it to look fun, not necessary but I love having the option. The only thing I'm not too crazy about is the ads that I keep clicking on accidentaly, a bit annoying when you're in a hurry, but hey, nothing's free in this world!",5
com.p1.chompsms,A Google user,"Chomp is useful and dependable. Does about everything I need a text/SMS to do. There are a couple minor annoyances, as far as i can see. If I have an established group chat and want to add a new person, i have to create a new group. would rather be able to just add one to existing group. there is no warning if a picture is too large, or if it's because there is text as well, but some things fail to send, which may not be apparent until much later when I open it again. resend won't fix it.",4
com.p1.chompsms,A Google user,"I like it very much. I can control it so that it's visually easiest for me to read and write texts. The advertisements are annoying in a way that all advertisements are annoying. After a little bit of time using it though, if you wait a sec and don't accidentally fall for the trap of tapping on the top message, which is actually the ad but resembles a message, you'll likely be able to skip even glimpsing the subliminal message and not clicking on it.",4
com.p1.chompsms,A Google user,Great app! I've been using another app for the last 4 years and I've changed to this one. The ability to customize is incredible. The only reasons for 4 stars instead of 5 are: 1. There is no draft indication. If you have to leave the app in the middle of a message and then return there is no indication of a draft message. 2. No ability to create multiple signatures. Should be able to create different signatures for different contacts. Otherwise a great app!,4
com.p1.chompsms,A Google user,"So far, less than thirty minutes of having it downloaded, it works better than a previous texting app I had. Pictures actually send. I kinda want to buy the full version, but one bad review of it hurt my chances. This is worse for me because my phone is an original Chinese version and I like the way it works right now, but don't want the ads and don't want how it works to change. I would like to be able to put different themes on each conversation though, to tell which is which easier.",5
com.p1.chompsms,Diane Smith,"Having issues...First off, I love the way your app allows us to customize the look of the app. Two issues I'm having: 1. I don't receive a pop up when I get a new text, just a little icon on the task bar on the top of the phone which is easily missed 2. Once I add a picture to a message, I can't look at the pic any more. I press on it to enlarge it and nothing happens. Even after I send the text, it won't allow me to see the pic except for the little thumbnail.",3
com.p1.chompsms,John McFarland,"Google message that comes standard on all phones is horrible. If you get ""message expired or unavailable"" then you need to download this App. I tried all the fixes for Google messages, and none worked. Chomp is great and works great. When I downloaded this app, I went into settings and made it the default app for messages and all my contacts and messages were loaded up. After about 30 days, they start showing ads, but it is just a bar at the top. No big deal. Thanks Chomp for an app that works!",5
com.p1.chompsms,A Google user,"Love this app, used it for years since having a smartphone. My only complaint is that there isn't an easy way to clean up the conversations list. I get tons of spam texts and if I want to delete or blacklist those texts, I have to do it one at a time. Multiple blacklist and multiple delete options would be a fantastic asset to this app. EDIT: didn't know about the multi delete in the settings. I still think a multi blacklist would be useful as well. Thanks!",4
com.p1.chompsms,Nicholas Thieme,"My default texting app wasn't sending texts to my wife for some reason. I could receive them and everyone else got my outgoing, but not her. This app did the trick. I love the customization options too. I now have a dark color scheme that's much easier on the eyes. The only thing missing so far, is the ability to mark messages as ""read"" from the notification pop-up. Not a huge deal, but a minor convenience I miss.",5
com.p1.chompsms,A Google user,"Shows something different than what is sent. If I send a picture, it'll show a completely different picture. Same goes for text messages. It doesn't always do it. It's very irregular. I can go into the standard messaging app and never have any issues. All issues I had have been resolved with help from Chomp SMS support team. I've updated to a 5 star rating.",5
com.p1.chompsms,A Google user,"This is really a great SMS app. I am currently using Textra and this is a definite competitor for my go to SMS app.  Just a couple of reasons why, I probably won't switch to Chomp.  1.  When viewing the list or message, the placement for a photo is a random ugly color that I cannot seem to change.  Is there a way to change this?  2. When I find a color that I like for the top bar, I want to be able to match that color all the way around, just like in Textra. It makes it very difficult to find the exact color over and over again.  Aside from that, this program has come a long way.  Thank you for resolving this for me.",5
com.p1.chompsms,Rob Perschau,"I like this app. It's clean, reliable and simple while still offering all the features I've ever wanted. I have my groups, my various notifications and my history. Speech to text works very well. Pick your color scheme and numerous other customizations. Customer service has been very responsive. Slight hitch when you take a picture from within the app and attach it to a message. It frequently will not send until you back up and reload the saved message. Not enough for me to change my rating.",5
com.p1.chompsms,Robin,"I only started using this app yesterday, but I already love it. However, I REALLY wish there was a way to split the profile pictures in group texts, to show each recipient's pic. For example, a group text with four people just shows ""4"" as the profile pic. This is not helpful if you have several group texts with different recipients. The recipients' names don't all show in the header, so you have to click each text to see if it's the one you want. Five stars if I can get this resolved!",4
com.p1.chompsms,A Google user,"Mostly good except for a couple of issues. I have difficulty sending text with pictures. Most of the time I end up sending the pic and then have to send the text separately. Also the ad at the top is annoying how it jumps around when you first open the app. It makes it so you inevitably click on the ad if you are trying to reply to the most recent text quickly. And it is not ""my internet latency."" I have the fastest and have no problem with anything else.",3
com.p1.chompsms,A Google user,"I paid the premium price quite some time ago but at random times over the years the ads keep coming back. You have to email and explain to customer service that you've already paid, which then they then correct it to have no ads, but it's really annoying to keep having to do it from time to time. I am stuck in one of the cycles again even though I've recently gotten text prompts from their team saying that the ""messengers enhanced features have been enabled"". Aside from that I love it though!",2
com.p1.chompsms,Ford Block,"I like the app. However, I had issues editing a theme. It didn't allow me to change color of new message bubble or navigation bar. Also it says it has Backup & Restore to an SD card. My phone doesn't have a SD card slot. So I'm not sure if it will just save to the phone. So I knocked off 2 stars. Also, I wish it could add more than one signature like Textra. If these 2 apps were combined it'd be perfect. If there was a Pro version to get these features I would pay. But I don't see Pro version.",3
com.p1.chompsms,Andi S,"As a visually impaired person, the stock SMS app on Android phones is pure garbage. This is a great replacement, and gives me most of the options I need to be able to send and receive messages easily. If I could see better, I would definitely decorate up my messages a lot more because with what vision I do have I can see that the themes offered are amazing. Definitely recommend.",4
com.p1.chompsms,kimberly lock,"I'd say I am 70% satisfied with the features, but there are a few missing parts... the individual text messages do not show the exact times. they're like grouped together and have only the time to be first message of the group was sent/received. also, when you want to share a screenshot (example) with a recent text, if the text did not come from someone in your contacts, you have to go back and find the text you want to send screenshot to instead of having a list of recent conversations.",4
com.p1.chompsms,Lloyd Pulley,"so far a very good messaging program with a lot of personalization. The only issue I am encountering so far is that, while I can take pictures to send, it doesn't seem to allow me to make videos. I have been able to send videos with all my other messaging apps (why so many apps, you may ask, and I have no good answer other than darn people won't agree on one service), but on this one, while I see setting for videos, there is no way for me to access making videos that I can see.",4
com.p1.chompsms,A Google user,"Been using it for years. Only have had minor issues a small of handful of times, and chomp cleared them up well. Recently had an issue with in-app notifications, and they were very prompt in responding to my e-mail, with a fix that worked immediately. Sad to see the color icon notification go, but, that's Google. Otherwise, quite happy with the app.",5
com.p1.chompsms,A Google user,"Does everything I want. I get to assign a different notification sound for each contact. I get to decide how many times I get a notification or if it continues until I read the text. I get to choose the color of everything, font type and size too. Basically, everything you have a right to control regarding how your phone handles texts, this app refuses to stand in the way. As the standard text app that comes with android becomes increasingly less functional and relevant, this app delivers.",5
com.p1.chompsms,Nicole “Mickey” Maschke,"8/12/21, champ is really a wonderful application for text messaging. But it does not have an archive function. Which, with so much economic stuff going through the text messages, is really very necessary. For that reason I'm only able to give chomp four stars. But it really is an excellent application. It's just not one that can actually compete with like a few of the others. So it still needs some work.",4
com.p1.chompsms,A Google user,"Great App! I'm another one that never gives a review but I've been using it long enough to give credit where credit is due. It's built with all the necessary features and all the many extra ones that make it that much more enjoyable. The convenience of being able to adjust when the message actually leaves after hitting the send button is a real friend at times for changing a thought at the last moment or to make a correction. Lots of features and never fails me. Great job, Thanks.. 🎶",5
com.p1.chompsms,Jim Gerry,"Very good app, but has one little flaw. Visually, it gets a perfect 5. My issue is this, if not petty, notifications. I think if you could personalize a notification for an individual conversation, or contact, like you can for a ringtone for phone calls, would be awesome. That way you know who just texted you without having to look. That would make me give it 5.",4
com.p1.chompsms,Lou Richer,"Have been using this app for years. I like all the customizations available much more than any other app. I have used them all, and this is my favorite. There's only been one issue over time that occurs once or twice a year and that is that the notification sound I've chosen stops working. The only solution is to uninstall the app, and reinstall it. I then reset the theme, choose my notification sound, and am off and running again until the next time. Even though this is a pain, it's worth it.",4
com.p1.chompsms,A Google user,"My Android phone was splitting up the messages every time there was a group message, causing each person's reply to come in under their contact and not as a response to the group. Lady at the store said it was because my phone is outdated (bought it in March) and said installing a new messaging app would not help. I had already tried several apps, with no results. Then I heard about ChompSMS through a Google search, and installed it. Group messaging now works properly!! I'm so happy. Plus I love the search feature, which my other app didn't have. So far, I'm very happy with it.",5
com.p1.chompsms,Robyn Buchanan,"Update: I don't think my issue was related to the app. I tried this app for several months but it had an issue showing previews of pictures and attaching them. There were so many things to like about this app, though! Pinning important conversations and giving an adjustable countdown to allow messages to be cancelled were particularly useful! If you're looking for a messaging app with quite a few useful functions, I do recommend giving this one a try - it just wasn't quite what I needed.",5
