Package name,Reviewer name,Review,Rating
com.google.android.apps.messaging,Aura Alta,"Poor interface. For example: Icons take up too much space, drafting window is too small, messages do not appear in proper order. We changed only because of a mysterious bug causing incoming SMS messages to fail silently that no T-mobile tech could explain. This should be called RCS, not ""Messages."" The confusing name caused confusion with the previously existing app native to the Samsung phone. Not pleased.",1
com.google.android.apps.messaging,penny grant,Messages is pretty good. Very rarely stops working. UPDATE: for the past few months I have not received any texts when my cell is turned off. It has caused so much trouble. Three times TracFone has tried to help me. This last session I did receive two texts through Customer Service. I was excited thinking my Messages was working again. Nope. Do you have a link or suggestions thatcan solve this problem?? Thanks,4
com.google.android.apps.messaging,Ashley Johnson,I had to get a new phone and now this app is not working properly. I'm a realtor and I have a separate app to share house listings with my client via text. Before I was able to do that but now it will not work. I have tried removing and downloading all of the apps about 3 times and still seeing the same results. I need for this to get fixed quickly.,2
com.google.android.apps.messaging,ann W-Fitz,There is no way to personalize. Cannot set font higher cannot change background color it is plain Jane Update You cannot simply take a picture then go to the messaging app to send..it's not right there. You have to hit folders then folders again! WHAT? Why isn't the picture I took most recently not available right there.. click on folders twice more???,2
com.google.android.apps.messaging,Austin Schriver,"Fast, secure, and convenient. The three words I use to describe RCS and Google Messages, If you're debating switching from your Mobile network's default messages app, this is the one to run to. It never disappoints with quick media sending, response prediction, or even looking for keywords like ""Time"" and giving active suggestions from your calendar. It's made my Smart Phone feel a little more like a ""Smarter"" Phone.",5
com.google.android.apps.messaging,Kim Sullivan,"It used to be fine, then one day the app icon changed and I could no longer receive vibrate notifications when a message came in. I cannot find anything on the phone or in the app to set vibrate. Now either I don't know when a message comes in, or it has to make noise and disturb everyone around me. Why would you change something in my phone without my permission to make it worse and cripple the functionality?",2
com.google.android.apps.messaging,Jessica Koflan,"It texts fine, but lately I have been having an issue with sending and receiving messages. I'm constantly clearing the little bit of cashe that's in the app and cleaning my actual phone. If I receive a message, then majority of the time I have to be expecting it because I also don't get notifications that I have one.",2
com.google.android.apps.messaging,BJ,"This is the best app I've used for texting! Not only is it more user friendly for those who like multimedia messaging but also like to have more manual control (fewer defaults that can't be turned off), this team behind the app actually listens to feed back and makes changes unlike most companies I've ever given feedback. This app and it's team are great! Good stuff!",5
com.google.android.apps.messaging,Kate Kay,"For several weeks, I have been unable to receive photos and documents. This is used for a business, and for years the old app was wonderful!! Why did you change something that actually worked? Also, the new icon is ugly, and looks like a glob of paint has dropped on my screen. Please change EVERYTHING back to what worked. Lastly, why have stupid emojis started popping up in all of my texts,? I repeat... this phone is used for business. I do not appreciate the emojis popping up everywhere.",2
com.google.android.apps.messaging,Krys Baxter-Ragsdale,"The app was great but something happened and suddenly the text prediction is horrible. Previously the app would suggest things similar to what I was trying to say and now what it suggests isn't even close to what I'm trying to say and I have to continue typing until the end of the word until the correct suggestion even pops up and by that time, there's no point selecting it when I've already typed the word.",2
com.google.android.apps.messaging,Mark Pashalis,"Frequent & Annoying ""Device Pairing"" notifications ruins this app. Love being able to pair my Pixel 6 with my PC to manage messages from either device. But being reminded every 10-20 minutes that the devices are paired is painfully annoying. Why, why, why? Really need a way to turn off this notification without turning off incoming message notifications. The Messages app has many app notification settings but I've yet to find any explanations on what they do. This REALLY needs to be fixed.",2
com.google.android.apps.messaging,Ben Perkins,I always loved this messaging app and it keeps getting better and better!! So incredible. I love the RCS features that make it possible to have more rich conversations with the people that I care about. The interface is gorgeous and fun and they're really pushing the boundaries of what's possible across the Android ecosystem. Super excited for what's coming next!,5
com.google.android.apps.messaging,Meredith Hammond,Updated: would also love to have an option to get text from trash for at least 30 days like some other apps. Also to where we can get read receipts from someone that has theres turned on too but if there using a different message app. really want to like this message app but even with read receipts on. I still can't see that my hubby read my text. WE have the same phone and his is showing read on his end but will not. I have tried absolutely everything!,2
com.google.android.apps.messaging,Beryl Nelson,"I had stopped using this app for a while because of some annoying issues. Now it's back better than ever. I have a simple request of the developer. In your next update can you make messages and gboard use current assigned system fonts, and option to change incoming and outgoing message bubble color. Current default font displayed in both apps are stoic!",4
com.google.android.apps.messaging,Adrian M,"It has potential, most annoying thing is that I have some group messages set to silent so I don't get notifications on my phone, which is good, but I keep getting notifications on my Garmin watch. 😔 Once this fixed I'd up to 5 stars, until then I may go back to my old messaging app. Its a bug in the app, I've checked all notification settings.",2
com.google.android.apps.messaging,louis daher,This is probably one of the most useful apps that I use unfortunately the synching between browsers and the phone needs a bit of work. With some tweaking of that I would have given it a higher rating. As well as some work with some automatic features for the photos. It's both a productivity and enjoyment app necessary for modern day life,4
com.google.android.apps.messaging,Jeff Edge,My messages don't pop up on the lock screen since Galaxy updated the phones. All of my setting are correct. I have also shut my phone down and restarted it. It was working fine until yesterday after the update. I hear the notification but no pop up. Please fix this bug because I really need to be able to see the pop ups. please tried and still don't work can some one help me,1
com.google.android.apps.messaging,Jacob Heiner,"I have one main complaint. But first, I really really love this app. I think Google has done incredible things and this almost competes with Apple's iMessage. However, my main issue is group messages. Whether on Android or not, group messages are a nightmare. Whenever anyone in the chat sends something, it sends it in a separate thread as a downloadable message. After I download it, it resends it into the group chat. That's so frustrating and I haven't figured out a way to fix that.",4
com.google.android.apps.messaging,Micah Knope,"Used to work pretty well but the past couple weeks I don't get all my text messages. I have to reboot my phone and then a bunch magically appear. Seems like tons of people have this issue. Google will point me to their troubleshooting page in response to this review, which I've already gone through. Avoid this app until it's fixed.",2
com.google.android.apps.messaging,J Kaufman,"Works, until it doesn't. The RCS chat features are supposed to be this wonderful new thing, but many times I think a message has sent only to find out minutes or hours later that the person was supposedly offline and the message never got sent. The settings SUPPOSEDLY allow me to automatically resend as a standard text message if the chat features are not available, but in reality the message does not automatically send as text, it just sits there unsent.",3
com.google.android.apps.messaging,Robert Ginn,"Wastes 90 percent of screen real estate! List of recipients at top, 4/5 of screen blank in the middle, tiny window at the bottom to type message. PITA to type a multiline message. Even with the teeny tiny scrollbar to navigate tiny window. No obvious configuration setting to fix this - but why wouldn't you use all available space by default anyway? All the demo pictures show 2-3 word texts, so it looks OK there. Previous phone had a usable messaging app, wonder if I can install an older one",1
com.google.android.apps.messaging,Jason Polhamus,this app used to work fine but for the last 2 or 3 weeks my wife and i have not been receiving messages from time to time. We need to restart to get them to come through. this is incredibly worrisome. it continues after trying all the tricks that we found. nothing works permemently and the issues continue. i recently switched back to the old app which is not as nice but i feel will be reliable. i sent message to support and received nothing back.,1
com.google.android.apps.messaging,Leona Hans,"I literally JUST got my phone and the very first messages I tried to send kept telling me ""unable to send message, tap to resend"". Nobody wants to open a NEW phone, go to text their family and friends, and then boom... you have to keep tapping to resend the messages. Now I've had this app for about 2 weeks and I still have to keep tapping until the message sends and I have full service, plus I have high speed WiFi. I don't have time to do this. What is going on? Can this please be fixed?",2
com.google.android.apps.messaging,Allen P,"And okay app, but top contacts appear when you try to chat. The top contacts cannot be changed. It doesn't even have my wife on there. It does have someone who I have not talked to for over 2 years as a top contact. They really need to fix this so you can customize who your top contacts are. Follow up after several months. Still only three stars. There's also issues with groups. I have not been able to delete a contact within a group. The search on Google does not have the updated edit menu.",3
com.google.android.apps.messaging,Logan Herrera,I've had this app for awhile and it's just been getting better and better as the years have gone by. They just updated it now to where you can see the little dots when someone is writing you in real time. It's also encrypted along with notifying when messages have been delivered or read. It's a great app and I recommend it. It also gets passed the group limit of 10 for me which is great! Thanks Google!,5
com.google.android.apps.messaging,Samantha,"Cannot send videos at all. I contacted Google Support regarding this and no one ever got back to me. Verizon Message+ is 100 times better. I have already looked at the trouble shooting page AND sent feedback. Please do not respond telling me to do either of these things. Based on recent reviews, this is clearly a huge problem. You need to fix your app, stop telling people it is an issue with their phone.",1
com.google.android.apps.messaging,Michael Chad Miller,"I got this app for the spam filtering feature, which does seem to work quite well. However, it seems to not be able to get and retain all of my messages, while my default messages app seems to retain them fine. It also seems to cause sync issues with Phone Link.",3
com.google.android.apps.messaging,Michael Brantley Jr,"I'm only giving it 2 stars based on my pass experience. If I was judging on my last 2 weeks I'd give no stars. Was literally almost the perfect app before then, now my chat messages hardly ever go through. And even though I have send sms automatically if chat doesn't go through. I still have to manually send it myself. It will tell me ""Chatting with such and such"" and message failed. Or one chat message would go through and then all the rest keep failing. I don't know what happened to this app.",2
com.google.android.apps.messaging,BC,"Totally USELESS! You are not only forced to leave your phone on, but leave this app open on your phone.... to text from other devices. You are also forced to be connected to wifi or data. I didint have to have my phone conected before to text, but have to connect it so other devices can connect? It CONSTANTLY checks to see if your phone is online, and even with the phone next to the tablet.... cant find the phone, so it loses connection and wont text. This app is a joke! Stock VZ MSG was better",1
com.google.android.apps.messaging,Logan Peever,"The app has some connectivity issues for me. Also it considers most incoming messages as spam without checking with me first. I assume that must be a setting though and I assume it isn't ""invasive"" so it doesn't check the message to see if it's spam or not. Also, personal opinion- the interface isn't too great. (edited/rewritten) I apologize for my earlier review, it was rather harsh. I'm sure if these minor things were fixed it'd be an amazing app. 👍",4
com.google.android.apps.messaging,Alan Kite,"I've been having a lot of trouble being able to copy/paste into messages, basically a long press doesn't always work, sometimes a reboot helps but sometimes not. Also with this new update I hate the new icon and it messes with my eyes, why did Google have to change it? I don't really know how to explain it but my eyes have trouble getting it into focus. Thanks Google I already know how to copy and paste, when you long press it does nothing, you feel the feedback but doesn't show the options.",2
com.google.android.apps.messaging,Katrina,"My messages have stopped working since this update. Half the time my videos and pictures I want to send don't send or it takes several minutes for a short text to be sent or received. How do I get my old app back? I just deleted tons of apps, pictures,videos and messages and it still won't work.... The information you commented with doesn't work either. If my message was reviewed and read you would see I already did all of that. That's the exact thing you just sent! How can it be fixed?",1
com.google.android.apps.messaging,Robert Winter,Its a basic no frills app. Often the android to android messaging doesn't work in great service area. Wish it would have option to automatically switch to sms if service is down or alert to switch to sms faster than it does. I have messages that sometimes never deliver or deliver on one side and then the replies don't deliver on the other side Because they are messaging back thru the service that isn't working for me.,2
com.google.android.apps.messaging,Steven George,"Not all messages are coming through. Contacted Verizon and Samsung. Verizon says its a know issue. You have IT people make a website to fix the issue. We shouldnt have to reboot the phone, cut the phone off for 5 min, clear message app cache, and or network reset. When will this get fixed permanently. People depend more on text for business/personal than a phone call. BTW, the app works great. We just need to get important messages. Not just some, all!",1
com.google.android.apps.messaging,Daren Egan,"I love this app and use it constantly, even the web component on my PC, which has replaced another, less ""awesome"" app. Google is constantly updating Messages, trying to make it better; I love that! If only Apple would play nice with RCS, that would be great. Thank you Google for making such a great app and for trying to bridge the gap between Android and Apple",5
com.google.android.apps.messaging,L B,"TL;DR THE NEW UPDATE IS DELETING TEXTS. After the recent update when I get a notification of a text message I will tap the notification, the app will then open, and the text disappears without a trace. At first I thought maybe I was mistaken but then it happened again so I called the family member that sent the text and they verified they sent the text. So. The new update is deleting texts. Fortunately for me I don't use this app for work otherwise It would be deleting valuable text messages.",1
com.google.android.apps.messaging,Merissa Henson,"The one issue I had with this app was fixed so I'm upgrading my review. I like using this app better than the one that came preinstalled. However, I did get stuck on chat with one person somehow and had trouble switching back to sms. We both had to delete each other from our contacts and then re-add each other to fix that issue. Chat feature is now turned off for good on my phone.",4
com.google.android.apps.messaging,Ashley Snyder,"I actually love messages & it is my default messaging app. I have used it so long that the standard one just isn't an option anymore. I love how you won't ever loose messages even if you switch phones or loose it. I would of given 5 star's, but there's one issue. A lot of times it doesn't stay (say) connected & I'm can't t receive any text. I just go to settings & connect it manually, that turns out to be (& fix) the issue, as all my text come in right after. Other then that it's a great app!",4
com.google.android.apps.messaging,Maria Angelozzi bryson,11/4/22 Why doesn't this have a talk and text feature that types as you speak? 🤨 The one you have is a voice recorder that sends to the receipent. Referring to hands free typing Apparently my system recently updated and after it did everything is smaller. I can't even make out the wording as i am typing or see the responses either. I am thinking about uninstalling it! Update as of 12/27/20 I reinstalled this app and now it doesn't allow you to set a notification sound. Really frustrating!😔,2
com.google.android.apps.messaging,Bonnietelo Cole,"The only issue I've encountered is that the font size inexplicably became huge and it bothers me. It was like the rest of my phone, normal sized, but now it's so big that I can only see 3 messages at a time. Please add a way to change the font size for this app specifically, since it's apparently not allowed to match the phones font size anymore.",4
com.google.android.apps.messaging,CreepStar Gamer,I've been using this sms app for a couple of years now. Being able to change colors of people's messages was a new feature then. (Which they need to bring back) for the most part I like this app and don't have a lot of complaints. Although I am not a fan of the new icon and I do not like the oversimplified logos and icons that all these companies are moving towards. I like colorful bubbly/cartoonie icons and logo's better. Everything's just getting bland nowadays.,3
com.google.android.apps.messaging,Clayton “BEASTLYMONKEY27” Cowden,"You know it's good, does what it's supposed to do and a little more. Good integration with GIFS and even some Snapchat features. The stickers feel a bit lame at times, and I would like more choices but I do love the artists. I give it a. While I wish to have the ability to take the pseudo motion capture characters that iphone offers. I am very pleased with ability to combine emotes to get more specific and unique uses. That feature alone is superb!! 9/10 overall",5
com.google.android.apps.messaging,Daniel Mahan,"I can't use this Google texting app on my Google phone because after every time I open it and click okay through all the alerts about how texting works, the keyboard won't show up anymore and everything I touch is delayed, including opening apps themselves or changing any setting. It's so confusing to me how a default app can cause that, but since I have not opened this app, my phone has been working fine.",1
com.google.android.apps.messaging,Rancher Rob Nebraska,"Lately, large texts come in broken up into many smaller texts that are not in order and will come in all at the same time. For example, if it's broken into eight small texts, I might get the second, fourth and 6th at 4:00 p.m. a half hour later two more will come in and 20 minutes after that the rest show up. On other phones it comes in as a single large text. Extremely frustrating, makes it almost unusable. Rec'd email asking 4 clarification but the email link provided came back as unmonitored",1
com.google.android.apps.messaging,Erica Johnson,"For the most part, I like it. There are a few changes that can be made. One of those things is showing you still have unopened/unread texts after replying to other texts. The notification disappears. Another thing, it should have more themes/wallpapers (not just black or white).",4
com.google.android.apps.messaging,Rob Quan,I had the ability to respond to iphone messages with emojis for 2 days and then the app updated again and now that feature is gone. What happened? Update: i tried resetting the app data and cache and it still does not give me the ability to reply to iPhone messages with emojis. I've tried uninstalling and installing again. I've tried turning my phone off and back on. It's like the option never existed,2
com.google.android.apps.messaging,Impossible Photo123,"Moved to a new phone (Same model as previous) and the messages app (while it successfully sends and receives messages) gives me an error that reads ""Not sent, tap to try again"". The messages have been delivered, but for some reason, my phone doesn't think they've been successfully delivered. This problem now seems to have migrated to all of the messaging apps I have tried. Not sure if this is app specific, but it only began after installing (uninstalling, clearing cache, reinstalling etc)",3
com.google.android.apps.messaging,Mary Saville,"Before the last update, the app was highly successful at sorting SPAM texts into an archived folder I never had to look at. Now many political spam texts are getting through. Very unhappy. Also, why can't it automate sending by SMS if the chat message fails? The point of messaging apps is to reach the person as quickly as possible.",2
com.google.android.apps.messaging,Marcia S,"I was using Messages as my primary messaging app, but the most recent update causes many of my text messages to not send. What in the world is error 28 and why now when I did not change any settings?!? No consistentcy. I noticed before that iMessages do not always come through, and my messages do not always reach iMessage recipients. This app is causing communication problems! Reloading it hasn't fixed the problems so it must be in the app coding.",2
com.google.android.apps.messaging,Jason Olson,"Severe battery drain (and extremely hot phone) even when phone is NOT BEING USED. I thought I could fix it myself: I turned off access to camera. I turned off sync. I've read online that the recent update corrects the bug that's causing severe battery drain. Nope. So I switched back to Textra app. 24hr battery usage went from 57% to 1% just by changing my app. I can't use my galaxy watch to text without this app. Cannot change battery optimization, not an option. Something is extremely wrong.",1
com.google.android.apps.messaging,Eric Peterson,"The update that got pushed within the last few weeks made a lot of changes that I HATE to many apps on my device. The new app icons in the drop down for my notifications are too rounded and all look very similar. My phone is now telling me about ""apps running in the background"" that are SUPPOSED to be running in the background. And the messages logo makes me feel like I'm hallucinating, with the slightly different shades of blue bubbles now overlaying each other.",1
com.google.android.apps.messaging,J- Kane,"I've always had Android phones with this app pre installed. I've never had problems up until last month (Sept. '22) I've been getting delayed texts up to 2 days late...very annoying. I'm a construction superintendent and most of the communication with clients are done via text so everything is ""in writing."" So getting delayed texts can have a big impact on the productivity of a jobsite. Not to mention texts from family and friends and you don't respond. Looking into another app",2
com.google.android.apps.messaging,Alexander Kozhevnikov,"Seems fine enough, but it can be really non-obviously, needlessly, inconveniently slow. For example, after it first suggested categorizing conversations into personal and business, I noticed that conversations would take 20 to 40 seconds to load after I clicked on them. My message database is large, but it didn't get slow until the categorizing - as if a a background indexing task was poorly written and blocked/bottlenecked loading+rendering messages in the foreground.",4
com.google.android.apps.messaging,Scott Larsen,It is supposed to transfer my messages over from Hangouts. It doesn't. It sends texts but doesn't receive the replies. I cannot believe a company the size of Google STILL can't build a chat app that actually works. Thanks so much for forcing me to use this (Google Fi is dropping Hangouts). Hangouts was clunky but worked. Almost makes desperate enough to switch to FB for messaging. Oh yeah plus the Feedback button inside Messages returns a 403 error (page not found). LOL,1
