Package name,Reviewer name,Review,Rating
com.p1.chompsms,John Ready,"I like it but it's not perfect. I switched to it for templates but they all appear in same type on same background - I have to look closely to spot where one ends and other begins. Also, if choosing a Contact only offers 1st number and only way to get msg sent to alternate number for that contact seems to be to type it manually. * Developer has suggested I try turning off ""Mobile only"" and that works but is deceptive* For all that it's better at handling my needs than some big name alternatives",4
com.p1.chompsms,Lisa Basalla,"I like the customizeable everything in this app. I ha e used this for years, but in the last few days I no longer see notifications on my lock screen, badge bar at the top or in my pull down notification drawer. If it was not for the notification on my Versa 4, I would miss all my texts. Please fix this.",4
com.p1.chompsms,Paul Dutton,"UPDATE!!! App has been updated and is working properly! I was using the program and it kicked me out and haven't been able to use it since, when trying to use it, it doesn't even load. This is the best most flexible and customizable sms app I've ever used! It's great and the support team is very prompt answering questions/concerns. Thank you for such a wonderful, awesome sms experience!",5
com.p1.chompsms,Howard Matthews,"Superior to the preinstalled app but I used to have different tones for texts and emails, now they're both the same one. EDIT: Looks like it's not this app but a system change, there were separate settings for each & now there's just one setting.",4
com.p1.chompsms,Allan Grossman,"I've been using Textra (Pro) for years and absolutely love it. Far better than the stock messaging app or any of the other 3rd party SMS apps I've tried (and that's a LOT 😉). Only just learned that Chomp was developed by the same folks as Textra and adds significantly more features and customization options for those of us who like to fiddle and make our apps ""our own"". I've been using it for several days now and it's GREAT. As good as Textra is, I'm enjoying Chomp even more.",5
com.p1.chompsms,Truth Or Consequences,I really love the app! The only problem is it's a little hard to follow sometimes.I would like to be able to back up my messages to a file without jumping through hoops I do like that you can send them to your email but I would like to be able to use the file and I'm not sure if you allow that to happen-also I have lost all of my messages a couple of times and I don't think it was anything I did so I wasn't too happy about that. I give you four stars because there's always room for improvement!!,4
com.p1.chompsms,Louise LMF,"I love this app for texting because you can customize colors, fonts, type size, images, etc. Definitely better than stock app. Individual notification sounds, blocking, etc help save time and cut down on interruptions.",5
com.p1.chompsms,Pastor Akin Bandele,"App stops working. I have used this app for almost a year to send group messages with no problems. But in the past 5 weeks, it stops working. I see a red ! by my message and no one receives my group messages. Please fix this bug; hope it's not your update causing my issue.",3
com.p1.chompsms,Kemeko M,"Update; it's been crashing a lot, might be because I have an older phone s10 from three years ago. But still a good app. It force closes when I send a message sometimes, seems to still send them properly. Use it on every phone! Love that I can custom it.",4
com.p1.chompsms,S Davi,"I like the app, and continue to use it because I seem to lose data with the Pixel 6 stock texting app. However, I would give it a perfect review IF: RE: text notification, if I don't mark as read I will get a second notification later. Also, regularly, I stop getting notified and have to click the ""test"" in settings or reboot to get it to work.",2
com.p1.chompsms,Cat Lincoln,"I absolutely love this app. Have had it for a few years now and always have it on a new phone, it is so customizable. I have reviewed it before a few years ago to criticize having no private box, which quite a lot of other users requested, but it is such a good app in other ways I will give up on that one and still give it 5 stars anyway.",5
com.p1.chompsms,Panthera “Ps2” Ps2,I Cannot use my fonts i download from internet and were do i look i do love the holiday background. But i custom. To my like needs more Incoming &ongoing. Bubble. style needs like a Xbox dashboard. Example & my notifications don't always get a chim for Incoming text or reviving them i don`t get a chim🗯🔔 Mostly family text or friend. Hello development. Fix the fonts so i can use custom. Font 🙄,5
com.p1.chompsms,Dave Fisher,"For whatever reason, I keep getting size limit reached errors when trying to send pics or videos. This is 2022 guys. Why are there still size limits? I pay for unlimited 5G and have a phone which records 4k@60fps and takes gorgeous pics....but I can't f***Ing share them because they are ""too big for Facebook messenger"" and ""size limit reached"" in ChompSMS. I shouldn't have to shoot my phone in the proverbial foot on image quality or video quality just so then I can share at potato quality.",2
com.p1.chompsms,jerry riedel,"Installed it, made it the default texting app and quickly discovered that it was not showing the last 2 weeks of texts between me and my girlfriend even though it was showing texts from last night from others. Uninstalled it and now the missing texts are shown in the defaultapp. Samsung Galaxy S10e, Android 12 with current updates...",1
com.p1.chompsms,Ibex1,"Working just fine, even GIF, Mms ?! Everything!! And SMS can be answered from lock screen without unlocking and time lost. Practical!! Perfect program. But direct share option in Samsung is not possible like with other programs. Searching for names is must.",4
com.p1.chompsms,Jovan Denaut,"I HATE IT SINCE LAST UPDATE! I've had chomp the paid version for several years and LOVE IT!! With the update on Sept 19, I've cycled back to the free version with ads. I'd be willing to pay again for ad-less, but it won't allow me because I already have the paid version. HATE THE ADS IN MY PAID VERSION!!!",1
com.p1.chompsms,David White,"I cannot get them to solve some long-standing + repeatable issues that made this app frustrating to use. Every time I email they ask for the same thing they asked for previously + that I did/sent. This is a waste of my time, not support. I am a paid user + like the app except for the problems and failure to use what I previously collected and sent.",1
com.p1.chompsms,E K,"I was just charged by Google for my annual Chomp Pro subscription and suddenly today I'm getting ads after updating. App is now asking a one time fee for Pro. Huh? If this is a new payment model then why did I just get charged for a ""subscription"" and did not get any notice of the change? No info online anywhere. Or is this just a bug? Very frustrating!",2
com.p1.chompsms,Renee G,Love the app!! Had it for years. But haven't been able to change themes lately. Keeps saying this app has a bug.. I've updated and reinstalled.. help. Thanks,4
com.p1.chompsms,Phil Stracchino,"Chomp SMS is my favorite SMS app. The killer feature it has that stock SMS apps don't have is not its extensive list of downloadable skins, though some of those are very cool and there's enough variety that almost anyone will be able to find one they like. The real killer feature is Chomp's ability to blacklist senders of SMS spam (or anyone else you don t want to ever speak to again) and simply reject their messages unseen. Sadly I recently discovered this does not work for MMS spam.",5
com.p1.chompsms,Richard Roosa,"Good, so far. Been using for about a month. Has not crashed or hung up. Be patient with setting individual ringtones, took me about 30 minutes to figure out how to achieve success. Once i got the hang of it it was smooth sailing from thereon out.",5
com.p1.chompsms,Donal Slemon,"Decided on this app from reading other reviews. It mostly does what it says on the box but I'm disappointed as most times I'm not getting SMS notifications that are sent from my bank, nor those that I use for other apps to confirm sign in with 2FA. Occasionally with the latter I receive if I hit resend on the app I'm signing in to. I don't have any of these issues as soon as I switch my default messaging back to my previous app. Phone is a new Redmi note 10 s running Android 11.",3
com.p1.chompsms,Bruce A,"If you click on the menu button, there are only a few options. And one of them is to entirely delete all of your messages. I can't think of a worse idea. But there is more. There is a backup/restore option. All this does is backup or restore your settings. Not your messages. So you might think you're safe, but you're not safe. This is a joke of an app. Try use your phone in the rain or after a few drinks and you're going to end up with a completely blank phone. It is verging on malware imo.",1
com.p1.chompsms,Judai Winchester,"I like this app and was a good replacement for the last sms app I used to use. However, there seems to be a bug in the system whenever I try to edit my theme (customization) and the app keep crashing. Can somebody please look into this and get this fixed? Thanks.",3
com.p1.chompsms,Shay S,"I usually love this app but now there are group text spammers. When I try to block via long hold I do not have option to block sender in a group text, only for a single person texting. And now there is a repeated error message pop up but that app is working fine.. Please fix and I'll upgrade review. UPDATE: and now weird numbers that end in a dash cannot be blocked either.",1
com.p1.chompsms,Bonnie Mulligan,"Good. Just one request: when the messages pop on the status bar, I'd like the option to mark read in addition to replying. It's cool that you can swipe the notification to mark read, but I want the notification to go away while leaving the message marked as unread or having the option to mark it read.",5
com.p1.chompsms,Tristin Young,"This is a feature rich program which allows great customization! There are a few features I miss from other programs that I have used in the past, however, this program meets many of the needs which I was seeking. It is well worth the time to customize to your heart's content.",5
com.p1.chompsms,AlvinJaymes “JayAlvinJj” Arcega,"still testing if it delivers what it promises. so far still trying. i will give good review and ratings later on. keep up the good work. (i love it is fast, easy, simple to use and not lots of confusing options and selections.)",5
com.p1.chompsms,Daniel S. Lewis,"Love this app. Went away for awhile, but found myself coming back again. Update: Still love the app but it's getting left behind. It has a lot of features sure, but now a days, you need protection as well. There is no encryption protection, plus no chat capabilities. With as long as this app has been around, you'd think they'd keep up with the times and keep their pro users happy? Hell, I'd even pay an upgrade fee if it wasn't outrageous, as I said I love the app, they just update to 2022.",4
com.p1.chompsms,Laurel,"Love how customizable this app is, and its not as glitchy as some text apps I've used. However, it would really benefit from 1) the ability to schedule texts and 2) an archive. Both of these features are available on Textra and Pulse.",3
com.p1.chompsms,Michelle Chin,"I do like this app very much, and have been using it for awhile now. However, lately I have become super annoyed with all the spam text that are overwhelming my space. These people are not on my contact list and I have not given them permission to text me. It seems the more I block, is the more spam I get. I feel I'm working too hard trying to rid myself of this aggravation. Please fix this.",4
com.p1.chompsms,PawsitiveThinking,I like this app alot. It's missing the fifth star because you cannot schedule multi recipient texts. You can schedule single recipients. So if you're planning something and need to text everyone you can't schedule it.,4
com.p1.chompsms,Jeffrey Jones,"I absolutely love this messaging app! I am a pro user and have been for a year or two now and totally support it. However, since the last update for some reason it's not sensing my pro status and it keeps telling me to pay for pro even though I already did. Other than that it is absolutely amazing Please fix this little bug thank you :-)",5
com.p1.chompsms,Noel Jones,"The stock app that came with my new android 11 phone was very dull. I wanted to add my own notification sound but would not get it to work. I searched for another app and came up with this one. I love the fact that you can customise the colours etc. and of course my ringtone. After using the app for a while, I got a message to tell me my add free trial was up, so I purchased the full version and am very happy with it. I am 73 years old and find everything about it easy for me. A happy bunny.",5
com.p1.chompsms,Stacie Kennedy,"It's not too bad of an app. I like it but the problem I keep having is whenever I go to change the theme, it won't pop up the options. I hit the ""theme it"" button and it keeps coming up blank and won't load.",3
com.p1.chompsms,les wilkinson,"UPDATE I found chomp and decided to give it a try, as it's made by the Devs that make the excellent Textra SMS app🐯.. I am hooked, this app has just about everything you might need in a SMS / MMS app, and more. All I can say about the app, is it needs to be on your phone. The free version has ads, but they are hardly noticeable. But personally i would go for the paid version. You can't go wrong with Chomp SMS. Thanks developers, for all the work you have put into the app",5
com.p1.chompsms,Robert Jenkins,"I paid, and this app still connects to your ad server, and yahoo, to phone home. Askng me to contact you, when you know your app does this, is senseless. Just turn off tracking and spyware and ad connections if people pay. Simple.",1
com.p1.chompsms,Andrea,The icon is so cute but the bright green is ugly and clashes with everything so that bothers me personally & I'd like the option to change the colour... and I'm not able to like/love texts like other people do to mine..? Other than that it's a good app👌,4
com.p1.chompsms,David Ransom,"So far, it's been an excellent app. Much better than Pulse SMS that just STOPPED working on me one day??? My only suggestion for this app: Make deleting a message 'swipe-able'... instead of having to go thru the menu system to do so.",5
com.p1.chompsms,Izabela R,"I think it's a beautiful app, they way I've got my custom theme/colours I made. It doesn't take longer to load with a theme than without unlike another app. I'd add that it would be great if there was a search button to narrow down a search by colour or style. So far seems better than most messaging apps. I wish this app had a dot on the app showing I had an unread message though.",5
com.p1.chompsms,David Black,"06Oct2022 - Recently the app deletes pictures attach when sending. Uninstalled, rebooted phone, now can not send but one picture to one person at a time. Been using app for four years with no problems at 5 stars.",2
com.p1.chompsms,Ciara Topps,Loveeeeeeee im a stickler for pretty accomodations as far as text back pages and distinguishing btwn diff contacts. CHOMP had its issues in the past but i think those kinks were figured out!!,4
com.p1.chompsms,chrisann pajarillo,"I've been uaing chomp a year and it never dissappoint me. It never logs, i can customize my own design and share to developer. I love this app so much. Ads may appear at the top of the convo list but it never bother me. Kuddos to the developer. I gave 5 star bc I LOVE THIS APP!!!!",5
com.p1.chompsms,Samuel Okah,"This is really a wonderful am for sms, nice designs and way to customize. However, I am finding it difficult to lock a group of messages within the chomp sms app, or archive my messages. Kindly assist me with necessary guidance. Thank you",4
com.p1.chompsms,Lisi Liz,I love this sms app. I thought I had an issue and they responded immediately! Turns out my issue was a simple fix. This is the best sms app and they have even better customer appreciation. Thanks for the quick reply! ♡♡,5
com.p1.chompsms,Gerald Macy,So far so good! Only messaging apps won't send pictures to an iPhone on at&t from my phone. So far this one does. I'll keep you posted!,5
com.p1.chompsms,Paul Sobkowiak,Like the app but a few upgrades would be nice. Doesn't tell when text delivered and have to occasionally reboot phone to get it to start working again.,4
com.p1.chompsms,Jen Sullivan,Been using this for many years. Lately my texts are still showing the sending icon even though the receiving person received it. Don't know if it's the app or my aging phone. Still love the app.,5
com.p1.chompsms,Rebecca Hamilton,"Honestly great sms app. I use it mostly for the customization. I have zero issues with the app itself except that I'm seemingly unable to send videos through it. Overall, I really enjoy using chomp :)",5
com.p1.chompsms,Johannes Wöhler,"1. In conversation list- please enable select multiple/mark multiple (for deletion, blocking, del/blocking same number). 2. App settings- pls enable sms blocking of all unknown numbers. Scams everywhere. Help us curb this. Spam detection on other apps are half-baked. Make it happen. Thanks.",4
com.p1.chompsms,Joyce Melling,"Excellent app, lots of customisation and useful features. Customer support also very good - when I had an issue they responded very quickly and sorted my query out straight away.",5
com.p1.chompsms,Fishy Fingers,Latest update causes adverts to appear.....not all the time and not really noticeable to be worthwhile so why bother ? is still a good app but don't update if you currently don't get the adds and don't want to pay for the premium version.,1
com.p1.chompsms,Mark Goodwin,Can someone tell why since installing Android 13 One UI 5 Quick Reply no longer shows on the lockscreen? Only when you open the phone do you see the Quick Reply box. This was my favourite feature too.,3
com.p1.chompsms,Melinda Baker,"I'm updating my review... I absolutely luv this app so mny customizations, it's gr8. I've been using this msgn app 4 few yrs now. I hada prob. with my last phone the Note 10 plus, so i emailed the devs n they fixed my issue. Now i have the new Motorola UW (ultra wide), n it wrks flawlessly. I've not hada prob yet. The only dwn side is i cnt install font pcks devs emailed me bak letn me no it's n Google's hands, now that they wouldn't b able 2 do anythng bout it. But no biggie, still a great app!",5
com.p1.chompsms,Kusuma Arvind,Have been using the app for over a year now. Was working seamlessly. Today it crashed...at a critical moment. Very bad experience,1
com.p1.chompsms,Steve B,Was working until recently. Android 12 Samsung S21. Whenever I want to insert a picture Chomp inserts the pic then it disappears and is replaced with an ! Update This has since been fixed!,5
com.p1.chompsms,sts2020 t,"I like chomp a lot. Tried many others but this one is my fav. Good customizing, simple. If there are ads, I don't even notice.",5
com.p1.chompsms,Sun Brother,"I love this app, been using it for years now! I only have one request! For the love of all the God's, please let us disable the emojii button! Please! I hate the damn thing so very much...",5
com.p1.chompsms,Les,Replaced my native message app with Chomp SMS. Having the mobile contact only option sold me on the spot 😃. Great options to personalise preferences. Quick and easy to use 👍,5
com.p1.chompsms,Carey Crews,Great App. Just needs a way to block spam group texts. I'm presently forced to add each ph. # in the group text to my contacts and then blacklist them. individually...NOOOOOOT GOOD!!! We need a way to block spam group texts in mass...PLEASE!!!!!,4
com.p1.chompsms,Terry S,"It's a good, light app. It freezes when sending sometimes and it's a bit laggy, but so was the stock sms messenger I have. Could just be my device. Works really well with the SWIFTKEY KEYBOARD , from the Google playstore.",5
com.p1.chompsms,Mechanical Wood Design,"So far so good. Just bought the pro version. It's a nice app so far, but it seems as it is missing incoming texts. Running my old txt app as control and I see texts I don't see on chomp. Will watch it",5
com.p1.chompsms,Roger Haft,My vision is not so good anymore. My finger sometimes slips and I send before completing the message. I like to compose before selecting the recipient. A recent android update removed the new message button. I had to select a recipient before composing a message. Chomp has the new message button and I can compose before selecting recipient. The color background is much easier to read than the messenger screen. Chomp is easy to use. Support is great.,5
com.p1.chompsms,Nunya Fockler,Hi I love your app but I would like the option to show or hide read receipts from message recipients and I would also like to see an option to hide the typing indicator when I'm typing thank you take care.,5
com.p1.chompsms,Barry Haugen,"I dont know why companies lie about the data sharing. Chomp claims not to share info with third parties. And yet with tracking blocking enabled , one can clearly see that they share information with Amazon, Verizon media and Tappx. To the point that over 500 attempts by Tappx in less than 5 minutes. Lairs plain and simple.",1
com.p1.chompsms,Matthew Davis,"This texting app is near perfect..but PLEASE ADD A ""MARK AS UNREAD"" OPTION FOR THE MESSAGES!!! 10/7/22 Update: Now that they added the ability to mark messages as unread, this app went from 5 stars to 6 stars...Thank you!!! A++",5
com.p1.chompsms,Rysn F.,"One of my top 3 favorite apps!! Any issues I have had, ""chomp Support Team,"" helped me resolve them (I've had maybe a hand-full, if that). I truly hope they stay arround for good 'cause I don't wanna go back to my stock texting app --- & definitely can't trust other texting apps. NOW... one of my top ""2"" favorite apps!!!",5
com.p1.chompsms,Amanda Nembhard,Great app! Just wish it had voice texting and the option to send videos.,4
com.p1.chompsms,Maurice Hinton,"Chomp SMS is a very friendly messaging system. I love its many features, it's ease of use, and how it is constantly being updated.",4
com.p1.chompsms,Akuto Sai,"Still has that issue after 3 updates; cannot un-mute a muted person. The only way to do it is to uninstall and then reinstall, but then you have to reset everyone's custom tones.",2
com.p1.chompsms,Ore Hernandez,"I did love it, but since yesterday it won't let me change the theme anymore. I cleared everything and it just continues to kick me out of the theme setting. Can this be fix....?",2
com.p1.chompsms,Kristian Hanner,Update: It is now fixed thank you for helping me fix it so fast 🙂 I have had Chomp for a while and love it but for some reason it has stopped letting me go into the Theme setting for several days now please help me fix that thank you that's the only reason I didnt give it five stars.,5
com.p1.chompsms,Terri Gallegos,"Some of my incoming texts get blocked, and sent to the stock messaging app on my phone. There's no options to fix this. I have to change my default to my stock app to read the text, and then Chomp deletes so my texts becuz I chose another default app. FRUSTRATING! I want to receive ALL my texts, and I'll decide what to block! Again, recipients not receiving my texts! Ugh!",1
com.p1.chompsms,Craig W,Love it. Switched to this after another app decided to change everything. No regrets. Works great! Thanks developers.,5
com.p1.chompsms,Evlyn,"**Edit Happy to find the problem. I'm thinking with latest update, the APN needs to be off, as I stumble onto individual apps power save mode and discovered this app needs to be omitted/off or not enabled .... I have always loved this app but past few days it is not working. Going crazy and causing huge problems w my phone. Today has been a nightmare w it. I just Uninstaller and installed again to see if it helps. If it doesn't I will remove it permanently and use what I can depend on",5
com.p1.chompsms,Ashraf Fawzy,"Chomp is a great SMS application with lots of unique features & full theme/interface customization (nothing like it). And what's really impressive is the prompt & quality of support they provide .. I honestly haven't experienced such a sincere, prompt support & problem solving with any other developer for years! Thank you Chomp for having such a great product & great support team👍",5
com.p1.chompsms,Dimitrios Papadimitriou,"Hi guys. Good effort but I have a couple of issues. 1. Sometimes when sending 2 texts one after the other and the first is sent but not delivered yet and the 2nd is sent through too, the 1st is never received, instead the 2nd is delivered twice. 2. Sometimes despite stripping the accents in settings, the text is sent in lower case, hence not stripping the accents. Please fix.",3
com.p1.chompsms,C Darnell,I've been using this app for over 7 years now and it's not functioning like it use too. I'm not getting my text and my contacts aren't receiving text. My favorite app but wish they could fix the bug issues. Using Samsung Note 20Ultra. Thanks!!,3
com.p1.chompsms,the Chadwells,"Have been a paid user for a long long time. Chomp is my go to app for texting. I've tried many others, but always return to Chomp because none of the others are as easy to use or as flexible. And, the customer service is first class.",5
com.p1.chompsms,Tiaqua Bradley,"I honestly love the app, however, I keep getting a message saying ""can't download mms. Check your Apn settings then tap to retry"". Can't find what they're talking about in the settings. Fix this and its an easy five stars.",3
