Package name,Reviewer name,Review,Rating
com.google.android.apps.messaging,terry davenport,"Have just swapped updated my Samsung phone and the messages system has been updated. It tries to swap, put what it thinks you want or takes words out you don't want. You have seen by all the negative feedback what a terrible app you have now but instead of holding your hands up and saying sorry we will revert back you seem intent on pushing on with something not fit for purpose. What also really annoys is the app underlining sentences foe no apparent reason other that to annoy.",1
com.google.android.apps.messaging,Erica Vernersson,"- EDIT 2: Reinstallation required every time a new conversation is started to get contact name. - - EDIT: Manual reinstall fixed the issue. - Conversations don't associate numbers with my contact list. If I start from the contact and press the message button, it opens the corresponding conversation, but only shows the number as sender. I've tried ""Add contact"" from the message and added the (identical) number to the corresponding contact, and I've checked all relevant permissions, to no avail.",1
com.google.android.apps.messaging,P,"Over the past two updates the app has start making notification sounds even though no message has been received. It's become quite annoying especially in the very early hours of the morning when I'm asleep. The only way I can sort this in the short term is to clear the cache, once I've sent a few messages the problem reoccurrs after not to long. Can you please address this? If the problem isn't fixed I'll have to uninstall and move back to my Textra app, which to be honest gave ZERO issues. Tks.",1
com.google.android.apps.messaging,Todd Williams,"Since the last update for bug fixes some numbers I save, the numbers show in my phone book but not on the message app. Went to the help centre and no way to contact for help. And the only advice there is to delete the contacts and re add them. Not useful if I have to do it every 3rd or 4th contact I add especially as they are working fine in the phone app. Guess the bugs that where fixed had babies. To the response clear the cache. Already done also force stopped the app and restarted the phone.",1
com.google.android.apps.messaging,Todd A.,"Updated to 1 star for two reasons. 1. Nice fake reviews Google. Very obvious. 2. The troubleshooting steps you are providing the MANY bad reviews is a bunch of bologna. Fix your trash app. Original Review: Was just an okay app, until the last update. Now I regularly get ""message not sent: invalid destination address"", when sending a picture. I switched to Samsung messages and guess what.... Not a problem anymore.",1
com.google.android.apps.messaging,MsLeshell23,"PLEASE HELP! I'm very thankful for this app. I've been using it for years. I keep a running text to myself of reminders, prayers, numbers, and important notes that I send to myself for a book. Somehow it has disappeared! 😩 I was going to send a text to myself and nothing was in there! It was as if it was my first text. I am so devasted. 😢 I checked to see if I could restore them. It looks as though there's a way, since my backup is on, but I wasn't able to figure it out. PLEASE CAN YOU HELP!!!",1
com.google.android.apps.messaging,Big Kat,"Abysmal performance when reading a conversation. I had to move sms from Signal back to Messages and enabled Chat/rcs - upon opening a conversation that had little history I would get a blank screen that would take 20 seconds to load. Opening an image in the same convo would take over 40 seconds. This was at home over wifi and the app would crash. Plenty of forums online about the isses, tried all of the workarounds. Nothing worked. Using SMS Organizer now. Fix ur app google.",1
com.google.android.apps.messaging,Daniel Broughton,"I'm having trouble with Messages because I'm saving contacts and then unable to find them in messages because their contact profile and their message profile isn't synced, so I have to manually look for their number or remember texts. Which is frustrating since my job requires me to text over 100 people a day. Hard to keep track of multiple friends and family. Need this sorted ASAP!",1
com.google.android.apps.messaging,Joe Little,"Switching from Signal since they're dropping SMS support. I can't expect all of my friends and family to pick up a messenger app just to talk with me. My biggest gripe so far is the UI. The color scheme for dark mode is ugly. Bring custom color theme support and then we'll be talking. So far the UE is great, everything seems smooth, I'll update to 4 stars if it continues going well for a few months. 5 stars if they add some actually appealing color themes.",3
com.google.android.apps.messaging,Barry Propes,"Well, not one hour after I wrote this review, I deleted some old threads within the app and for whatever reason it started working again correctly. I thank the developer for replying. I was unable to edit the original review for some reason so I wrote this new one. What happened to this? You used to could go very reliably search messages for content from long ago. Now it yields no results. Any ideas? Did this after an update.",2
com.google.android.apps.messaging,Frank Dushan Hanisko,"What's with the new icon? Was it purposely designed to look blurry? What utter fail Enhanced SMS is junk. I get a delivery notice in SMS, that now gives me options to reschedule and more with queen interface. However basic functions have now disappeared. I can't forward the message for instance or copy the information. Why would they remove basic functions?",1
com.google.android.apps.messaging,Leigha Jane,Extremely frustrating! You're telling me I can't change the notification sound for my messages over all?!?! I have to go into EVERY. SINGLE. CHAT. and change the sound that way!?! Everything I've looked up online explains how to do it but when I go into the settings where I'm supposed to it says that two categories have been deleted which I'm assuming is the category settings I need in order to make those changes! Also add some customization to the chats! Take notes from message+ by Verizon!,1
com.google.android.apps.messaging,ohthatpaul,"Very good messaging app: does everything you'd expect, does it well, and all with that cheerful Google look and feel. Appreciated: the readable typeface, cheery colors and emojis if that's what you're into, dark mode, rounded corners on its pics you send, able to handle conversations, groups, photos, video, timed texting, and more. Easy to use with a flexible powerful engine underneath. And backs up your convos in the Google cloud. 👍👍👍",5
com.google.android.apps.messaging,Olu McAgbana,"Every other thing is fine with this app, except some short messages that appear at the top of the reply line, can't count how many times those messages were wrongly and unknowingly sent to unintended recipients, I tried to see if the feature could be disabled, but no option for that.. It is a big snag that nullified all good feature that this app may have.",1
com.google.android.apps.messaging,Myranda V.,"Update made it worse... Since this new update, messages isn't functioning correctly. The search filter is only searching links and contact names, which is not a setting I can change, where before it searched all messages, photos, group names, etc. It's also very slow, and iPhone people can send emoji but not Androids. It also used to have these little fun Gifs it would add as you were typing and those are gone. Google, what the heck??",3
com.google.android.apps.messaging,blah blahblah,"I've tried everything to be able to view MMS messages, but nothing works. I've consulted every forum I can find, updated the app, I use my data, but nothing works... I'm at a loss Edited a while later:that problem was fixed. It serves its purpose as a messaging app.",3
com.google.android.apps.messaging,Barry,"I inserted a new SIM earlier and since then the chat features won't work. I have tried every trouble shooting tip in the help section(even though some of them have no resemblance to what is showing on screen), to no avail. I thought I'd try an uninstall, but of course that's not possible. Sodding useless.",1
com.google.android.apps.messaging,Victor Mobley,"Changed from 3 to 4 stars. They've made significant improvements to this app. A huge appreciation to the developers for continuous improvement. I left the last star unselected because I scheduled a text message to send, yet it failed. Once that's corrected and this app continues to be stable, I'll add the 5th star. Good job ladies and gents!",4
com.google.android.apps.messaging,urlocalmusicjunkie,"This app was working on my phone for nearly 3 years, but all of a sudden, it will not load properly when I try to access it from the home screen. The only way I can reply to messages is to tap on the notification when someone sends me a message. Google, FIX YOUR JANKY APP!!!",1
com.google.android.apps.messaging,Mark Garab,"Hey google, do you test your apps before releasing them? Don't answer that question cause clearly you don't. Messages stopped recognising contacts; it now just shows the phone numbers. Clicking on the sender's circle opens the contact as if it is not saved and shows the phone number with country code attached. Seriously google the kind of bugs skipping your attention doesn't show you in good light. This app is now practically useless.",1
com.google.android.apps.messaging,Josephadithya,There are many issues with this app. First of all the sync between chating and sms feature doesn't work at all. If I change to sms then i don't have an option to change in back to chat. It shows 'chating with ******' but still I can't use chat option. I recieved a message notification now but it's been recieved yesterday. The basics of messaging needs to be improved. I'm really want this app to be great so that we don't have to use whatsapp.,2
com.google.android.apps.messaging,Buck Rodgers,"It's pretty hard to best Verizon messages plus. Update: Downgrade from 3 to 2 stars. Update: downgrade to one star after trying for the third time. In my messages history, it showed that I had sent business pics to an old friend. I apologize to him and he said what pictures. I had sent them to the correct person after all. But this poor excuse for an app is showing that I sent pictures to people that I didn't! Delete.",1
com.google.android.apps.messaging,Danny Perry,"Was a great app up until a few updates ago. Now when a message can't be sent it doesn't automatically try to send it as an SMS and you have to do it manually. Problem is, when you do this, it doesn't change back to 'chat' and there's no way of reverting back. Also, not keen on the new icon. My mum is 72 and has difficulty in recognising certain apps and was used to the old icon. Now it's changed its a bit of a problem for her. Otherwise, it's a great tool that has a lot of brilliant features.",3
com.google.android.apps.messaging,Robert Ion,I was up on the mountains doing some hiking with some friends. We split up into 2 groups. We had carrier service but no internet up there. I tried to send an sms to get back together with the other group and the message failed to deliver. It also took a very long time to receive the failure notification. Eventually I figured it out and managed to disable RCS. I find it potentially life threatening in case of emergency by force enabling it by default.,1
com.google.android.apps.messaging,Amanda Sard,"Conversations vs messages is confusing. I can't find (or find any documentation) about how group texts are defines as one or the other. Mainly, no matter my default settings and clearing of cache, when new messages to a group chat do not use the default notification sound despite there not being any place to define defaults for conversations except within each individual conversation/group text. So frustrating.",2
com.google.android.apps.messaging,Marcus Shadwick,"Updating. Hey idiots, i can inly delete 1 message at a time lol, it will be easier to delete the app. So I can't add someone to a conversation. I have to, through all the steps and options that would lead you to believe you were adding someone to a group, then Hooray! You have a whole new blank conversation with 1 new person and the whole group. Not an option to add someone to a text string? Too complicated?",1
com.google.android.apps.messaging,Girard Ivory,My only issue is a big issue. Sometimes messages do not come through or won't sync. I've even watched messages show and then delete. Very troubling when waiting for a reply only to find out it was sent alread but you can't see it. No real fix out there either.,3
com.google.android.apps.messaging,Martin Lara,"Only thing keeping this rating from 5 stars is when searching key words using the search feature there is no 1/4 2/4 and so forth. You just need to scroll through the history of the chat and hope you spot the highlighted keyword you were searching for. Please add this feature, I'm pretty sure this feature was available awhile back. Thank you for your hard work and effort so far.",4
com.google.android.apps.messaging,Al Rice,"Conversations don't associate numbers with my contacts on sim-card or on my Phone stored locally. If I receive a new message from any contact from my phone it will show up as a number not the name. I have cleared the app's cache and data, I even reinstalled my Phone. Problem persists. Temporary solution was to downgrade to an earlier version of the app. Hope this gets fixed asap.",1
com.google.android.apps.messaging,Andreas Michael,"Hey there. I didn't had any issues with the application, however all of a sudden, when I'm writing in Greek and everything is fine, when I am sending my message, then all the letters are turned to capitals. I have looked for a solution through blogs however, I can't proceed with other settings, as there are no buttons at the described locations. Any solution to that? I would highly appreciate the developers could give me a hand.",4
com.google.android.apps.messaging,Pamela Gillen-Townsley,Some of my messages are not sending or reaching the intended contacts. Not sure if this is do to the messenger app that's allowed to do who knows what. But my contacts are ending up with three and sometimes four different numbers. Helping the response time of the sent messages would really be a blessing. I usually have a wifi connection when out of service providers range. But sometimes I am away from home it tells me waiting for connection then can't send messages out with my phone service.,4
com.google.android.apps.messaging,A Google user,"WARNING: DO NOT GET THIS APP!!!! They divide your texts if it's longer than, like, two lines (even less if you use an emoji for some stupid reason). The result is the receiver getting the divided texts out of order, making it confusing for the receiver to read. No wake screen options for notifications, either. Totally not worth it.",1
com.google.android.apps.messaging,Rebekah Budziszewski,"This app used to work wonderfully. But recently it decided to duplicate my group chats. For example, I have a group chat with my family. There are two threads and I'm not getting all of the messages on either thread. I've uninstalled, tried changing settings, but nothing has worked. This close to finding a different messaging app.",1
com.google.android.apps.messaging,Jesse Ames,"The app is ok. I really wish it had more customization features like the app mood does. Such as conversation background with pictures, conversation list background with pictures, bubble fonts and colors. I don't need an app to look like boring imessage from apple. I want something with alot of customization. That's why we love Android.",2
com.google.android.apps.messaging,Hayden Hung,"Really good until I just noticed an issue today on Dec 5, 2022 where all the messages I received from iPhone users were deleted except for the attachments, the text messages from only iPhone users have just seemingly disappeared and are not in my trash, I've reinstalled and restarted my phone to no avail. Googling the issue shows that they have not addressed this issue for many years.",3
com.google.android.apps.messaging,Tantan Tea,I have not been able to open Messages since the new update has been rolled out to my phone. An error message flashes but it's do brief I can't read it. Can't receive or send messages. Won't link to my computer. I cleared the cache - no change. I had to uninstall then reinstall for Messages to work. Still looking to see if I've lost any info as I've previously lost photos by reinstalling.,1
com.google.android.apps.messaging,Sebastien Carrier,"Downgraded from 5 stars as the wifi texting feature has been rather wonky of late. Sometimes it works fine, and other times my messages never send out. They also seemingly never roll over to sms automatically and I find out I've been talking to no one essentially, several hours later. Inversely, I can suddenly get flooded with 1/2 a days messages, from 1/4 my contact list, in one go as I leave wifi areas",4
com.google.android.apps.messaging,Giridhar Aynampudi,"Texts not being sent. MMS is working fine but SMS doesn't. I've tried restarting phone, force stopping the app but it doesn't fix the issue. It's not the issue with service provider too. I'm thinking about uninstalling and reinstalling but worried lose all my texts. What do I do? I'm on a pixel3xl",1
com.google.android.apps.messaging,Kelli Bell,"I do appreciate where it's going but I'd like some settings options. Can't change notifications sounds, and as Google has replied below, there's also no ""send feedback"" button. Editing after Google responded. There is literally not a settings button so that is my problem. Also no button that says I can add to my Galaxy Watch.",3
com.google.android.apps.messaging,Dan Lake,"Horrendous new logo design, not user friendly for those with needs. I have visual tracking needs and associated cognitive needs, such as Vertigo. The two tone design, which as far as I can tell is mandatory and cannot be replaced is impossible to use, as the logo affects visual tracking. A simple mono style alternative is needed as a necessity.",1
com.google.android.apps.messaging,Bobby Moniz,"I have Verizon Wireless so I usually use their VZ Messages app which is a red icon. It honestly sucks but I'm able to bill e-gift cards directly to account within the app only, and I can easily switch back but more than anything I LOVE the toggle option to READ INCOMING TEXTS ALOUD so I don't have to pick up my phone constantly and I live alone so nobody else hears it. When I go out I toggle it off. Can't figure out why other popular apps don't incorporate that? WHEN WILL THAT BE AVAIL HERE ???",5
com.google.android.apps.messaging,Pedro Ramirez,"Would have a solid 5 stars but ever since the last update I have had a massive amount of chat issues. Failure to connect, failure to resend, loss of connection even though other apps are connected(Pandora, YouTube). I tried to reset the chat connection, clear cache, and now I tried to verify my number again to no avail. Hope this gets fixed soon.",4
com.google.android.apps.messaging,RangaFromTonga,"Although chat features are connected to my mobile, it still sends via SMS only, switching back and forth from messages from people and then SMS from me. Everyday I have to uninstall messages via play store, update the app, restart the phone, download the app, verify and after a couple attempts of it verifying it begins working...come back the next day and it is still connected, but not working. I'm going to buy another Galaxy soon I think",1
com.google.android.apps.messaging,Dusan Pejcic,"You still can't copy part of message text. On older app that I had, you could hold your finger on message and choose smaller portion of text that you wanted to copy. Also, there is no option to zoom message over entire screen, which is very useful when you want to show only one message to somebody...",1
com.google.android.apps.messaging,Trish K,"Hate the new outgoing & incoming sounds, they're inaudible, can't hear them when in a noisy environment. Users want to set their preferred sounds. Reactions constantly popping up are annoying, PLEASE remove them! Emoticons already appear in suggestions, so don't need reactions. Please add these options: add signature, set driving/not available modes, color code theme/conversations, change fonts & bold, underline, italic.",1
com.google.android.apps.messaging,SR MK,"Contact names not showing. For ex. I'm calling one of my saved contact. But he or she is busy, so they cut the call with quick messages. That messages coming as new messages without their names. But their chat also available as a separate thread.now in my in box I'm having 2 chat threads for same contact with same number. One is with the name which I have saved. Another one is without name only number.",1
com.google.android.apps.messaging,Eric Thiele,"Since last update when I open app and click on ""start chat"" my keyboard no longer automatically pops up. Tried clearing cache, data, forced stop and restarted phone. Still won't Pop up keyboard Worked fine until yesterdays update. I'm done on my end for the fix. Someone needs to address your end for the fix. Its simply the update that's the issue. I'm not wasting my time when the issue is the latest update. Fix it. Problem solved with last update",1
com.google.android.apps.messaging,Ahmed Al-Methali,"Great app 👌 However, there is a problem when I want to send a message by swiping left on the contact name from Samsung phone app, the name of the contact doesn't show at all .. please fix this bug as soon as possible cuz I can't replace your amazing app. Appreciate your highly responsive reply. Thanks",3
com.google.android.apps.messaging,Kami Toghani,"Its excellent & very convenient app to be used for messaging eventhough texting itself isnt as popular as before. Since two days ago, I'm experiencing sync issue between Message App & google contact on both ofy devices! Why that happened out of blue? Tried to fix it by many ways but the problem is still there! Appreciate your help.",5
com.google.android.apps.messaging,Kate W,"The app no longer delivers messages to iphones. I receive messages, but cannot reply. I get an alert saying message not sent, tap to try again. But it never works! I've cleared the cache, cleared storage, but no luck. It appears to be allowing messaging to Android phones.",1
com.google.android.apps.messaging,elkarcher,"I have used this app for several years, and then suddenly, I can't get a sound when I receive an incoming message. Pretty frustrating. Been my go to app for messages, but might have to change, as I keep missing new messages as the arrive.",3
com.google.android.apps.messaging,brian fong,"Texts randomly not being sent.... Last couple of weeks texts are randomly not being sent. I've tried restarting phone, force stopping the app but it doesn't fix the issue. And then all of a sudden it will work again for no reason. I'm thinking about uninstalling and reinstalling but I worried I'll lose all my texts. What do I do? I'm on a pixel3",2
com.google.android.apps.messaging,Igor Bebic,"Not recognizing contacts from my Google account for received messages. It recognizes them when I try to send a message though. Tried reseting the cache and gave the app all permissions. It looks like it has problems reading contacts when they all fetched from my Google account, and are not stored locally on the phone as well.",2
com.google.android.apps.messaging,James Kellough,"Very frustrating. Have had several pixel phones over the past 6 years with this app and had regular issues with chat messages. Was required to send as SMS. Recently switched to Samsung Galaxy (better phone) but stuck with Google messages as default messaging app. Same issue with sending chat messages. Cleared the cash and all the other online solutions, problem persists. Had to go back to default Samsung messages app. Extremely frustrating, problem should have been solved by now.",2
com.google.android.apps.messaging,jm wilson,"Input box for a new text is squished to <1 inch, between the screen keyboard & the received text(s) that I am replying to and that I do not need to see while composing. Am unable to scroll them up out of the way. Inability to use most of the screen when composing long text makes this app SO irritating. On my next phone, I'll seek an alternative. I agree with other users; the double vision new icon is unpleasant. (Pixel2 user)",2
com.google.android.apps.messaging,JA Luminus,"I have a problem. Whenever I save new contacts from new messages received. It never shows the saved Contact name within the app. Only the #. Even repeated in another new saved contact. I tried clearing the app's Cache but to no avail. I am adviced to uninstall the app and reinstall. Which temporarily solves the issue. But then when I receive new messages from new #s and saved them, the previous issue persist. Saved contact name is not showing. Just the contact #.",2
com.google.android.apps.messaging,Chris Woods,Used it for years with no problem on my Pixel 3a for years now suddenly I can receive texts but refuses to send. Did all the normal resets and followed help guides and restart phone but no use. The phone is totally up to date and otherwise working perfectly. Contacted help and support with absolutely zero response.,1
com.google.android.apps.messaging,Matty Shore,Used to be great till they messed with the sounds I had set. Incoming work but if open and new message comes in it's now a new tone which is softer. I want to be alerted with every message coming in and that doesn't happen. Checked all settings and nothing changed except when updated smh,2
