Package name,Reviewer name,Review,Rating
com.google.android.apps.messaging,Faith Bono,"This app just saved me tons of stress, time, having to screen shoot messages and printer ink and paper since it automatically allows me to see my texts on my laptop. Thank you so much for that. I do have a few suggestions tho. While I love that I can block people from texting me and then go peek to see what they say, I don't like that I'm still notified that they texted me. I also don't like that I can't set backgrounds to contacts or make changes to the text bubbles. It's kinda bland.",4
com.google.android.apps.messaging,Matthew Lemmers,"This application has definitely managed to get much better and more feature rich over the last couple of years. One thing I noticed with one of the server side updates is that the sound which plays when a message is sent has changed. Not a huge deal, but why not give different options? Also including an option to vibrate when a message is sent as well. A popular sms app ""next sms"" already has this and it is a very nice touch to have.",4
com.google.android.apps.messaging,Chris Allen,"I feel like it's a 2.5 cause the main job of a messaging/texting app is to send and receive texts. But it gets stuck in a sending look when it's set to chat so I have to force it to change to text instead of messaging. But then the other person's messages aren't coming through. Idk if I'm using the beta and that's why it seems so unstable and barely usable. Aside from that I don't have much issues it's customizable, I can change individual backgrounds and notifications.",3
com.google.android.apps.messaging,Elizabeth Riviere,I am so frustrated with this app. I can't change the things I want to in Settings. There's tmi & settings for Chat Features but I don't want Chat Features. I want to have just my incoming text messages show up so I don't have to reread my outgoing messages and sift through them all to figure out who is texting me. But there is no way to select that seemingly simple option. It is so annoying. Plus I can't seem to turn off the auto correct and more often than not it guesses wrong. Useless app.,1
com.google.android.apps.messaging,Doug Luther,"Why can't we change the background color or be able to set pictures as the background? First time using it and feels like I'm bored with it because of the dark color. Also very annoying that the chatted stats up after you send a text plus the chat box stays up after you send a text. If you were to have the features Chomps has, this would be the best app ever.",2
com.google.android.apps.messaging,Kayleigh Cook,"I'm suddenly having issues sending messages to people. I'm regularly receiving an error message that says ""invalid destination address"" about people whose numbers I've been texting for years, and if I send it again it goes through. I'm also not fully receiving texts. I'll get some texts sent to a group chat, but others won't come through so I'm only seeing half of a conversation. And it's not consistently one person's texts, it's random. This bug really sucks, it needs to be fixed.",1
com.google.android.apps.messaging,Myk Overton,"Meh. The stupid sound that it makes when you send a text is really irritating...and apparently you cannot turn it off?! I like this app because of the archiving feature, but having to listen to that stupid sound each time I send a message will make me uninstall this one and go back to what came with the phone. Get rid of the sound that goes out when sending texts please...or allow us to turn it off.",3
com.google.android.apps.messaging,Cherylynn Rios,"This app sucks. It's always in ""Connecting"" status so you have to go back in and check to make sure your messages have actually sent. I've uninstalled it and reinstalled. I've cleared the cache, tried turning on airplane mode and turning it off to reset the settings, restarted the phone etc. And it's still sits on connecting.. it's a nice app when it works, but it's not reliable AT ALL, and has caused issues because messages don't send or aren't received. Already did feedback through 3 dots!",1
com.google.android.apps.messaging,Daniel Mercado,"I have no idea what happened recently, but for the past few months I haven't been able to get texts as they're sent. Especially with group chats. I rely on those specifically for work, so if I can't see something, I'm screwed. Individual texts seem to work fine. It just looks like it's group texts that are slow as well as photo texts. Whatever this issue is needs to get fixed asap cuz as I said, this is for work mainly. It's getting to the point that they're wondering why I haven't fixed it. 🤦",2
com.google.android.apps.messaging,Jon Enge,"Dev said to change ring tone for contacts. I have thousands of contacts and I just want ALL text messages to have the same sound that is different from the default. - I don't believe there's a way to change the default text message sound in this app which is important so I know what kind of notifications I'm receiving. If I'm wrong, let me know. I really like this app. Good messages, I can write th from my computer, I just wish it had likes, etc... On messages like the iPhone text app",2
com.google.android.apps.messaging,Mal S,"Seemed to be working great All of a sudden, my conversations won't load. I can see my list of messages. However, when I actually try to open a message/conversation, all I get is a blank screen. I was given directions to ""clear cache."" This had absolutely no effect on my issue. I still can't open and view full conversations.",2
com.google.android.apps.messaging,linndany,It's great and works for the most part but my only complaint is that group texts aren't automatically downloaded if data is not turned and once data is turned on you have to literally go in and download each individual text that was sent. It would be nice if it were to download itself once data is turned on rather having to click each text from each person. Otherwise this is a great app.,4
com.google.android.apps.messaging,Stephen Johnston,"Unreliable. Constantly not sending messages. I used to trust messages that were sent. Now I have people think I am ignoring them and ask me a second time or call me. To resend, I have to select each message and manually change to SMS. Like others, I have looked up many articles, but nothing resolves this issue. (Including the suggestion the developer is giving below. I saw this tip replied to others having this issue, and it didn't help me at all.)",2
com.google.android.apps.messaging,Judy Mudore,"The upgrades that were done in November 2022 messed up my texting feature!!! I can no longer receive texts... I can send them, but no one can respond. I went through the trouble of doing a factory reset on my phone and I got some messages to come through for about an hour then nothing AGAIN!!!! Please leave things alone that work.... I'm totally frustrated!!!",1
com.google.android.apps.messaging,Brandon Wilson,"Good app, when it works, but for the last 2 months, I've had to keep resenting all my messages through sms/mms because the chat feature has what I think crashed to the point that I have turned it off, I haven't seen any updates for I have looked. Makes me want to revert back to my default messaging app. This all started after the November 7th update. Now, for the question of the day, will I ever hear from Google about this issue?",2
com.google.android.apps.messaging,Mrs. AJ Brookins,"I do not like I had no choice it took over my phone, especially without warning. The first time it made it so I could not send/receive pictures. I had to do a hard restart after trying multiple other things. NOTHING IMPROVED. The only change for the supposed better is you can use emojis on texts like iphones. I am not a fan of emojis so I do not care about this upgrade. I would prefer regular text back. It worked great for me.",1
com.google.android.apps.messaging,traci clemens,"Since the update on 11/21/22 my husband, friend and I are all having issues sending and receiving texts. They are severely delayed, don't mark as read once they are opened and looked at, notification icon does not go away after opened and your outgoing messages doen't show when you send them so you don't know if it went or not for a delayed period. This has caused me to send the same message multiple times. Annoying!",1
com.google.android.apps.messaging,Jalisha Tucker,"I really like the chat features involved with this app. I'm actually sad that I can't use it anymore. Sometimes I can't receive messages. I thought my friend was ignoring me before I found out I wasn't receiving HER messages. Sometimes the app won't send messages either; I have messages saying unable to send and others pending send for DAYS. It won't allow me to send videos at times, specifically to iPhone users (I have an Android). No troubleshooting has done any good.",2
com.google.android.apps.messaging,Ben L,I have to tap each picture to download and view. When someone sends me a bunch of pictures it makes it very annoying to handle. I made a post on the forums but no response. If I get a picture while at home on wifi there should be an option to automatically download the image. It seems developers changed the outgoing message sounds option to include both in/out texts. There's no way to just have incoming sounds now. It sounds like an iphone which is terrible thanks...,1
com.google.android.apps.messaging,Joe Catbagan,Like the app but noticed I don't always receive text messages sent to me or can send texts. It's so random. I first noticed 3 weeks after upgrading to a new phone I sent a text 1 morning and it said not sent. I checked if an update was needed but nothing. I had to restart my phone in order to send the text and receive messages I didn't get before. It's starting to happen more often which is bothersome and annoying. Didn't have an issue on my old phone. I've uninstalled and reinstalled but same.,1
com.google.android.apps.messaging,Karly Kirk,"I love that you can switch back to SMS. I will say, I do not like how videos are shared when it's through a different system. What I mean is, us Android users versus IOS. I love this app, but I wish there were ways to send videos better without having to send someone with an iPhone/IOS, a link to the video, at least thats how it appears, as a link to Google photos. Fix? Is there not a way for media to be shared across all systems, no matter the system setup (IOS/Android)? It's definitely lagging",4
com.google.android.apps.messaging,D DL,"Whatever upgrades you did to the application from 6-8 weeks ago, and even now, totally messed it up 😡 I have to unpair the phone or the tablet and then reestablish the pairing in order to get the messages to sync. If you do any action like deleting or archiving a message from the phone by swiping that message it does not sync on the tablet. It results in the tablet having old messages that it can't get rid of. Somebody test this stuff before you roll it out.",1
com.google.android.apps.messaging,Hailey Turner,"i like the app and it’s been my favorite message app so far, but it has so many bugs. whenever i put in a word in the search bar, it tells me 'no results found' even though i know there are messages with that word. the app also has trouble sending long messages. anything longer than 3 sentences won’t go through and i have to restart my phone to get the message to go through. this app needs lots of work done and hopefully will be fixed before i have to find a new messaging app",2
com.google.android.apps.messaging,Brian Rea,"I use this app to send mass texts. Half the time. The people don't get them. Now. It won't even let me send messages to people on my phone. Half of the time it works fine. Now II can receive messages but Just can't send them. Then all of a sudden it'll start working fine again, it's weird. I have a Google pixel 6 pro and I've taken it in. They said there's nothing wrong with it. The problem is with this app",1
com.google.android.apps.messaging,candyland8903,"I keep having tons of issues with this app. I have deleted it and reinstalled it numerous times. I keep getting duplicate msgs and it will send out duplicates to recipients. I have restarted my phone every day since updating this app and I don't know what the update did, but my app has not worked right this whole month since updating it the last two times. Update since response. I cleared the cache also and I'm still having tons of issues!!!! Every since u updated the app, it has not worked!",1
com.google.android.apps.messaging,Kathy P,"I prefer this app over my T-Mobile message app, it's more familiar. However in the last week or so I've gone through all the troubleshooting and still can't figure out why when sending photos it now takes 10 min or more and sometimes sends it twice. Doesn't matter if I'm on wifi or data. It's a recent issue. Maybe from latest update? No problems with basic text tho. Little frustrating.",4
com.google.android.apps.messaging,Linda SGJ,*update it's working great now😃 I stopped using my last texting app. Ok... So I really love the application but lately... I had updated it and it started crashing. It wouldn't even let me access any messages. I would open it and it would close down. I had to uninstall the updates for it to work normal. Not sure if anyone else is experiencing something like that? But just in case? Maybe the updates should be looked over? I've a pixel 3a. Thank you.,5
com.google.android.apps.messaging,Sean Thomas,"So far it works, but it's not as feature rich as some other apps.. but I just got the pixel 7 pro and I haven't had an actual Google device since the early days when Google was new.. I'll update it later as I have more time to see how it works! Time will tell.. What I expected from Google I didn't get out of my grand new Samsung Galaxy tab 8+, is everything just works out of the box, without issues or complicated setup, notifications to my pixel watch.. rating can only go up!",4
com.google.android.apps.messaging,Colette Leirer,"It's terrible! I absolutely hate it. It says it sent a message and then later says it couldn't and I'm constantly switching to text just to get things to send. I want my previous app back and cannot find it on my phone, but it is on my husband's phone, and he has the same phone and same plan. Stop messing with what already works!",1
com.google.android.apps.messaging,Jeremy Breckbill,"If it had the ability to personalize tones for different contacts and the ability to disable Amber Alerts I'd give this app 5 stars. In response you wrote,""...you can submit feedback within the Messages app by clicking the Menu button..."" I don't have a menu button, so I'm changing my rating from 3 to 2. When I emailed my concerns to the address you provided, your reply was, ""You have emailed an address that is no longer being monitored."" Your app support is cheerful yet awful. 2 may become 1.",2
com.google.android.apps.messaging,Justin Harrington,"Worked great for a while...the latest update won't let me send encrypted messages to another phone that uses the same messaging...really freaking annoying. Update:. Developer I have cleared the cache, uninstalled, reinstalled, reverified my phone number for chat, and it still doesn't work. It's on your end clearly. I see several similar complaints on the reviews. Do better.",1
com.google.android.apps.messaging,Rachel P,"Generally works well, I do occasionally have issues with it not alerting me when a message comes in and sometimes it will make me switch to SMS/multimedia or else it won't deliver my message, and that prevents me from seeing if my message has been delivered or read. My messages sometimes don't go through at all, but this is likely the cell service itself.",4
com.google.android.apps.messaging,Jen Estrada,"It was installed on my new phone and I've had trouble sending and receiving ever since. In a group text, I only got one text in the whole thread where 8 people were chatting. Sometimes it will send texts to individuals and sometimes it won't -- I get frequent ""working in the background"" messages. I've uninstalled and reinstalled with no change. The network is fine and if I switch to FB messenger for my default SMS my messages will actually send so that's what I've done for now.",1
com.google.android.apps.messaging,Susan Hood,"This latest update does not allow me to attach photos directly from Google photos app, it automatically goes to Samsung Galaxy and I cannot fix it. It also allows you to only attach one picture at a time instead of selecting several at the same time. You have to go through the routine of clicking attachment, clicking gallery, clicking photos, then clicking on the one you want. Very frustrating.",2
com.google.android.apps.messaging,Ermalene Hobson,"Since your recent update, I am unable to delete multiple messages at a time. Somehow, that feature doesn't exist anymore. Whenever I select a message it shows a line of emojis- why??? I can't select another conversation without deselecting the previous one - how time consuming. 🙄 Please bring back the ability to delete multiple messages at a time!!! Also having problems with the app freezing. What's up? I use to love using this app! 🙃",3
com.google.android.apps.messaging,Kelley Evans,"The app has worked fine until recently. Messages won't send. If I receive messages from others they are late. Sometimes I don't get them at all. Yet, if I make a call or send someone else a text all of the messages that have been lost suddenly show up. It's annoying. I even upgraded my phone due to this issue thinking my old phone was the problem. But nope. It's this app apparently. Because it's still happening.",2
com.google.android.apps.messaging,Pamela NelsH,It's works for the most part. The thing I can't stand is the sound connected to outgoing messages. NOT THE NOTIFICATIONS!! I'm talking about the sound when you create the text and hit send. It's dull and flaccid and sounds like an error. Was that the best the developer could do?? Because wow... Please add an option to turn off the sound or change it.,3
com.google.android.apps.messaging,Peter S,"Buggy, crashes, loses functionality from time to time. Pinning texts is cool, but only three at a time is limiting. The new icon is visually an annoyance, like blurry double vision. Sharing media or contacts with iphone is slow. Great for just saying hello to a friend. Developer response to reviews is lightning fast (thank you), however, I would prefer if these systems worked without having to manually manage them, clear caches, etc.. not what I'm paying for is how I feel.",2
com.google.android.apps.messaging,marshall rose,"It's a very good app and has very good features that my other default messaging app lacks, such as the ability to send videos over 0.3 seconds long. My one major recommendation is the ability to use chat features like replying to messages and adding reaction could be used even with people who don't have the app (if possible). Other than that I have not had a problem with group messaging.",5
com.google.android.apps.messaging,Lorie F. Waters,"Weird glitch happening after most recent update--I've generally had a good experience with the app, but recently when I try to open a new message by clicking the notification bar/message preview, it jams up and won't open. When I click my back arrow, then it opens up the main app and list of all messages, and then I have to click back into the new message. Just a bit of an annoyance that I'm hoping has an easy fix!",3
com.google.android.apps.messaging,Parker Gordon,"I wish there was a way to view all 'unread' texts. Sometimes they get lost deep within my messages and I never respond. I feel like that's a pretty important feature that's missing, it was enough to almost make me use my phone's default message app instead (but that one had other, weirder, worse problems). Other than that it's very good, 5 stars if that feature gets added in for sure",3
com.google.android.apps.messaging,Michelle Taepakdee,"I can't switch the messages from Rich Communication Service (chat) to regular SMS (text), and because of that, they always fail to send. After they inevitably fail, then I get the option to switch. I've looked up dozens of help articles, and they always go through how to change the settings, but the app won't let me change the settings. It's made me extremely angry and frustrated. I absolutely loathe this app with a passion, but most of my friends don't use Whatsapp or LINE, so I'm stuck.",1
com.google.android.apps.messaging,Kayla Villareal,"I loved this app as it was easy and convenient to use until today when my chat feature stopped working. I tried everything from turning off my wifi, to restarting my device, to checking my sim card, to using airplane mode until I had no choice, but to uninstall the updates to the app and it erased all of my message history. All of which was very important and now it's all gone. The experience, as a whole, was excruciatingly frustrating and extremely disappointing.",1
com.google.android.apps.messaging,Nathan Gill,"Like others have mentioned, if the other party receiving a text has the same app with chat but it is shown unavailable then the message will fail to send. I don't want to be constantly checking my phone to see if a message has gone through or not. I turned on the setting where it automatically switches to SMS text if the chat fails to send but that doesn't work. If the receiver is unable to receive the chat it still does not send a text. Hours will go by before I realize it hasn't sent.",1
com.google.android.apps.messaging,Brandon Rouse,"After this most recent update. My texts have been glitching out. For instance, if I'm at the end of my text and try to scroll back up to the beginning. The screen will start jumping up and down and becoming distorted. I have ran into other problems as well. Please run another update to fix the bugs. Text messaging shouldn't feel like you're fighting a virus just to send a simple text",1
com.google.android.apps.messaging,Rei Mettille,The new sort function is incredibly frustrating. I'd love to be able to label contacts as business or personal so it sorts my texts properly. Right now it just seems to send spam to business. I really think it would be great to have the ability to customize your categories as well. My phone gets overloaded with work contact and I forget to respond to personal texts because they get lost in the swarm of work texts. Just food for thought.,2
com.google.android.apps.messaging,Jim Stewart,"New update forces me to stare at my phone to see when i get a text while in text conversation. No notification sound! There is some non-audible disturbing sound. I want my selected notification sound to go off when ever i get a text, when i'm engaged in a text conversation as well as when the program is closed. Why send out update that cripples the usefulness of this aplication? Please fix this! Thank you!",1
com.google.android.apps.messaging,g33kxx,"A few months ago I lost the ability for RCS with my husband (same model phone S21, same Google Fi service) now I no longer see anyone's name on notifications, even when they're saved in my phone. Group texts I miss some messages. I submitted a ticket after the 1st issue and haven't heard anything. I'm very frustrated to be forced to use this app (to get short texts from auto senders) but I no longer get the basic features of other messaging apps.",1
com.google.android.apps.messaging,Bradley Carpenter,Requires data at all times. Most of the time when I'm texting I do not have my data or WiFi on just because I don't find it nessisary. In order to send or receive any messages in this app you have to have your data on. I have changed all the settings to make it auto send when not connected to data or WiFi but it doesn't help. This app sucks don't use it unless they fix this issue. Even Message + works way better then this cracked app.,1
com.google.android.apps.messaging,Jon Simon,"Latest update is very buggy. Messages showing as drafts and ""sending"" even though they have already been sent. Archived threads coming back from the archive. Search function basically useless if it's not going to give results for words and phrases that I know exist in certain message threads but it doesn't show anything. Do better google.",3
com.google.android.apps.messaging,Bodine,"This updated version lacks too many features compared to Apple. Unfortunately, when traveling internationally, the app can't handle transitions from country to country. Contacts in group chats would start showing only as numbers, even when adding the +1 country code in the Contact app. Spell check and word selection process is abysmal and inaccurate constantly.",1
com.google.android.apps.messaging,Sapphire C,"For over a week my messages now ask me to resend messages for almost every message I've sent. I've restarted my phone, deleted messages, and changed my settings to automatically resend as sms or MMS, however, it doesn't do so. It still asks to tap for more options asking, to send the message as sms or MMS. This is annoying. I went to the help forum and NO RESPONSE. Time to find a new messenging app.",1
com.google.android.apps.messaging,Raymond Wong,"After the updates, I have experienced severe delays in receiving and sending text messages. I just received a text this morning that was sent yesterday. I wonder if today's developer forget that the heart of this app is reliable communication. If the app cannot meet that standard, even with all sorts of fancy addons and it is still be useless. A phone with highend camera is useless if one cannot have clear conversation. Please fix the core issues before loaded it with fancy stuff.",3
